file_name,uni,wylie,url,dept,grade,char_len,audio_len,path,inf
STT_NS_M0200_0660_4522226_to_4530503,ད་བྱུང་ན་སོ་སོའི་ནང་ལ་གལ་སྲིད་ས་ཆ་ཆེན་པོ་འདྲ་བོ་ཡོད་བ་ཡིན་ན་རཱ། སོ་སོ་ཚལ་བཏབ་སོ་སོས་ཤིང་སྡོང་བཏབ་ཟ་ཡ་རེད་ཤག ,da byung na so so'i nang la gal srid sa cha chen po 'dra bo yod ba yin na rA/_so so tshal btab so sos shing sdong btab za ya red shag_,https://d38pmlk0v88drf.cloudfront.net/wav16k/STT_NS_M0200_0660_4522226_to_4530503.wav,STT_NS,3,108,8.277,wav16k/STT_NS_M0200_0660_4522226_to_4530503.wav,ད་བྱུང་ན་སོ་སོའི་ནང་ལ་གལ་སྲིད་ས་ཆ་ཆེན་པོ་འདྲ་བོ་ཡོད་བ་ཡིན་ན་རཱ། སོ་སོ་སོ་སོ་བཙལ་བཏབ་སོ་སོ་སོ་ཤིང་ཏོག་བཏབ་ཟ་ཡ་རེད་ཤག
STT_NS_M0193_0243_1931064_to_1933850,ང་ཚོ་ཕ་གི་ལ་ཟ་ཁང་འདྲ་བོ་མང་པོ་ཡོད་རེད་ལབ་ནས་ངས་ལབ་སོང་བ།  ,nga tsho pha gi la za khang 'dra bo mang po yod red lab nas ngas lab song ba/__,https://d38pmlk0v88drf.cloudfront.net/wav16k/STT_NS_M0193_0243_1931064_to_1933850.wav,STT_NS,3,58,2.786,wav16k/STT_NS_M0193_0243_1931064_to_1933850.wav,ང་ཚོ་ཕ་གི་ལ་ཟ་ཁང་འདྲ་བོ་མང་པོ་ཡོད་རེད་ལབ་ནས་ངས་ལབ་སོང་བ།
STT_NS_M0195_0449_2914274_to_2918837,གུང་སེང་འདྲ་བོ་ལ་མ་འགྲོ་འདྲ་བོ་བྱས་ན་ཨེ་ནས་ང་ཚོ་རྒན་ལགས་དེ་ཚོ་ཡ་ཡུད་ཡག་པོ་ ,gung seng 'dra bo la ma 'gro 'dra bo byas na e nas nga tsho rgan lags de tsho ya yud yag po _,https://d38pmlk0v88drf.cloudfront.net/wav16k/STT_NS_M0195_0449_2914274_to_2918837.wav,STT_NS,3,75,4.563,wav16k/STT_NS_M0195_0449_2914274_to_2918837.wav,ཨ་གུང་སེང་འདྲ་བོ་ལ་མ་འགྲོ་འདྲ་བོ་བྱས་ན་ཨེ་ནས་ང་ཚོ་རྒན་ལགས་དེ་ཚོ་ཡ་ཡུད་ཡག་པོ།
STT_NS_M0202_0439_3351977_to_3354183,སོ་སོ་སོ་དགའ་དགོས་རེད་ལབ་ཡ་ཅིག་འདུག་བ་ ,so so so dga' dgos red lab ya cig 'dug ba _,https://d38pmlk0v88drf.cloudfront.net/wav16k/STT_NS_M0202_0439_3351977_to_3354183.wav,STT_NS,3,39,2.206,wav16k/STT_NS_M0202_0439_3351977_to_3354183.wav,སོ་སོ་སོ་སོ་དགའ་དགོས་རེད་ལབ་ཡ་ཅིག་འདུག་ག།
STT_NS_M0203_0230_1502482_to_1505162,བལྟད་མོ་ལྟ་ན་འགྲིག་གི་ཡོད་རེད་ཡོད་བ། བལྟད་མོ་འདྲ་བོ་ལྟ་ཨེ་ནས་སོ་སོ ,bltad mo lta na 'grig gi yod red yod ba/_bltad mo 'dra bo lta e nas so so_,https://d38pmlk0v88drf.cloudfront.net/wav16k/STT_NS_M0203_0230_1502482_to_1505162.wav,STT_NS,3,67,2.68,wav16k/STT_NS_M0203_0230_1502482_to_1505162.wav,ལྟད་མོ་བལྟ་ན་ཡ་འགྲིག་གི་ཡོད་རེད་ཡོད་བ། ལྟད་མོ་འདྲ་བོ་བལྟ་ཨེ་ནས་སོ་སོ།
STT_NS_M0200_0476_3262619_to_3271749,ག་འདྲའི་ད་གད་སྙིགས་དེ་ག་འདྲ་དབྱེ་བ་ཕྱེ་དེ་ཚོ་དང་པོ་ཕར་བཞག་རཱ། སོ་སོ་ག་ཚོད་གད་སྙིགས་ད་ཉུང་ཉུང་བཟོས་ཐུབ་ཡ་ཀ་ཅི་ཐབས་ཤས་བཏང་ཡ་རེད།  ,ga 'dra'i da gad snyigs de ga 'dra dbye ba phye de tsho dang po phar bzhag rA/_so so ga tshod gad snyigs da nyung nyung bzos thub ya ka ci thabs shas btang ya red/__,https://d38pmlk0v88drf.cloudfront.net/wav16k/STT_NS_M0200_0476_3262619_to_3271749.wav,STT_NS,3,128,9.13,wav16k/STT_NS_M0200_0476_3262619_to_3271749.wav,ག་འདྲའི་ད་གད་སྙིགས་དི་ག་འདྲའི་དབྱེ་བ་ཕྱེ་དེ་ཚོ་དང་པོ་ཕར་བཞག་རཱ། སོ་སོ་ག་ཚོད་གད་སྙིགས་ད་ཉུང་ཉུང་བཟོ་ཐུབ་ཡ་ཀ་ཅི་ཐབས་ཤེས་གཏང་ཡ་རེད།
STT_NS_M0196_0090_873488_to_876530,ད་དེ་ཚོ་ལས་ཀ་ཡོད་རཱ་ང་རང་ཚོ་མི་དཀྱུས་མ་གི་ད ,da de tsho las ka yod rA nga rang tsho mi dkyus ma gi da_,https://d38pmlk0v88drf.cloudfront.net/wav16k/STT_NS_M0196_0090_873488_to_876530.wav,STT_NS,3,44,3.042,wav16k/STT_NS_M0196_0090_873488_to_876530.wav,ད་དེ་ཚོ་ལས་ཀ་ཡོད་རཱ། ང་རང་ཚོ་མི་དཀྱུས་མ་གི་ད།
STT_NS_M0201_0362_2487261_to_2494701,སོ་སོ་གི་ལས་སླ་ཤོས་དང་མགྱོག་ཤོས་དེ་ལྟ་ཡི་རཱ། ཨེ་ནས་ཨོ་ཡིན་ཙང་ད་འཕྲུལ་ཆས་དེ་ཚོ་གིས་སོ་སོ་ལ་རྦད་དེ་ཁོ་རང་།  ,so so gi las sla shos dang mgyog shos de lta yi rA/_e nas o yin tsang da 'phrul chas de tsho gis so so la rbad de kho rang /__,https://d38pmlk0v88drf.cloudfront.net/wav16k/STT_NS_M0201_0362_2487261_to_2494701.wav,STT_NS,3,106,7.44,wav16k/STT_NS_M0201_0362_2487261_to_2494701.wav,སོ་སོ་གིས་ལས་སླ་ཤོས་དང་མགྱོགས་ཤོས་དེ་བལྟ་ཡི་རཱ། ཨེ་ནས་ཨོ་ཙང་ད་འཕྲུལ་ཆས་དེ་ཚོ་གིས་ད་སོ་སོ་ལ་རྦད་དེ་ཁོ་རང་།
STT_NS_M0188_0063_647574_to_651340,མོ་གུང་སེང་མར་སླེབས་རྒྱོ་གནམ་གྲུའི་པེ་ཤ་ཚང་མ་མོ་རང་བཏོགས་ནས་སླེབས་ཡིན་ལབ་སོང་ཡོད་བ། མོ་རང་རང་གིས།  ,mo gung seng mar slebs rgyo gnam gru'i pe sha tshang ma mo rang btogs nas slebs yin lab song yod ba/_mo rang rang gis/__,https://d38pmlk0v88drf.cloudfront.net/wav16k/STT_NS_M0188_0063_647574_to_651340.wav,STT_NS,3,99,3.766,wav16k/STT_NS_M0188_0063_647574_to_651340.wav,མོ་གུང་གསེང་མར་སླེབས་རྒྱོ་གནམ་གྲུ་པེ་ཤག་ཚང་མ་མོ་རང་གཏོར་ནས་སླེབས་ཡིན་ལབ་སོང་ཡོད་བ། མོ་རང་རང་གི་
STT_NS_M0199_0375_2768821_to_2770830,ལུང་པ་དེ་ཚོས་སོ་སོ་ཀ་ཅི་ཕྱོགས་ཡག་ག་དེ་མ་ཤས་ ,lung pa de tshos so so ka ci phyogs yag ga de ma shas _,https://d38pmlk0v88drf.cloudfront.net/wav16k/STT_NS_M0199_0375_2768821_to_2770830.wav,STT_NS,3,44,2.009,wav16k/STT_NS_M0199_0375_2768821_to_2770830.wav,ལུང་པ་དེ་ཚོ་སོ་སོ་ཀ་ཅི་ཕྱོགས་ཡག་ག་དེ་མ་ཤས།
STT_NS_M0198_0017_125110_to_129155,རྒྱ་གར་སྤྱི་ཚོགས་ནང་ལོགས་ལ་དང་ཤོས་ཁོ་རང་ད་འཛམ་གླིང་འདིའི་ནང་ལོགས་ལ་ཡོད་བ་ ,rgya gar spyi tshogs nang logs la dang shos kho rang da 'dzam gling 'di'i nang logs la yod ba _,https://d38pmlk0v88drf.cloudfront.net/wav16k/STT_NS_M0198_0017_125110_to_129155.wav,STT_NS,3,74,4.045,wav16k/STT_NS_M0198_0017_125110_to_129155.wav,རྒྱ་གར་སྤྱི་ཚོགས་ནང་ལོགས་ལ་དང་ཤོས་ཁོ་རང་ད་འཛམ་གླིང་འདིའི་ནང་ལོགས་ལ་ཡོད་བ།
STT_NS_M0202_0489_3652824_to_3656749,སོ་སོ་ཡང་གལ་ཆེན་པོ་བརྩིས། མི་གཞན་པ་ཡང་གལ་ཆེན་པོ་བརྩིས་ལབ་གི་རེད་ཡོད་བ།  ,so so yang gal chen po brtsis/_mi gzhan pa yang gal chen po brtsis lab gi red yod ba/__,https://d38pmlk0v88drf.cloudfront.net/wav16k/STT_NS_M0202_0489_3652824_to_3656749.wav,STT_NS,3,72,3.925,wav16k/STT_NS_M0202_0489_3652824_to_3656749.wav,སོ་སོ་ཡང་གལ་ཆེན་པོ་བརྩིས། མི་གཞན་པ་ཡང་གལ་ཆེན་པོ་བརྩིཡ་ལབ་ཀི་ཡོད་རེད་ཡོད་བ།
STT_NS_M0193_0435_3188090_to_3190992,ཨ་ནས་ཟ་ཁང་ལ་ཁ་ལག་ཟ་ཡ་ཡིན་པ་ཡིན་ན། ནང་མི་མཉམ་དུ་ད་ཕྱི་ལོགས་ལ།  ,a nas za khang la kha lag za ya yin pa yin na/_nang mi mnyam du da phyi logs la/__,https://d38pmlk0v88drf.cloudfront.net/wav16k/STT_NS_M0193_0435_3188090_to_3190992.wav,STT_NS,3,62,2.902,wav16k/STT_NS_M0193_0435_3188090_to_3190992.wav,ཨེ་ནས་ཟ་ཁང་ལ་ཁ་ལག་ཟ་ཡ་ཡིན་པ་ཡིན་ནས་ནང་མི་མཉམ་དུ་ད་ཕྱི་ལོགས་ལ།
STT_NS_M0183_0011_74087_to_76413,ཤ་ཡོད་ལ་ད་ང་ཚོས་ད་འདི་ལབ་ཀྱི་རཱ།  ,sha yod la da nga tshos da 'di lab kyi rA/__,https://d38pmlk0v88drf.cloudfront.net/wav16k/STT_NS_M0183_0011_74087_to_76413.wav,STT_NS,3,34,2.326,wav16k/STT_NS_M0183_0011_74087_to_76413.wav,ཤ་ཡོད་ལ་ང་ཚོ་ད་འདི་ལབ་ཀི་རཱ།
STT_NS_M0196_0334_3637295_to_3642773,ཨ་བཟོ་གྲྭ་འདྲ་བོ་དང་དེ་འདྲའི་ནང་ལོགས་ལས་ཀ་བྱེད་གར་འགྲོ་ཡི་འདུག་བ། ཨ་ནས་དེ་ཚོའི་ནང་ལོགས་ད་ཁོང་ཚོ་ལ་དབྱེན་འབྱེད་འདྲ་བོ་བྱེད་ཀྱི་ཡོད་ས་མ་རེད་ཡོད་བ།  ,a bzo grwa 'dra bo dang de 'dra'i nang logs las ka byed gar 'gro yi 'dug ba/_a nas de tsho'i nang logs da khong tsho la dbyen 'byed 'dra bo byed kyi yod sa ma red yod ba/__,https://d38pmlk0v88drf.cloudfront.net/wav16k/STT_NS_M0196_0334_3637295_to_3642773.wav,STT_NS,3,146,5.478,wav16k/STT_NS_M0196_0334_3637295_to_3642773.wav,བཟོ་གྲྭ་འདྲ་བོ་དང་དེ་འདྲའི་ནང་ལ་ལས་ཀ་བྱེད་ཀར་འགྲོ་ཡི་འདུག་བ། ཨེ་ནས་དེ་ཚོའི་ནང་ལོགས་ད་ཁོ་ཚོ་ལ་དབྱེ་འབྱེད་འདྲ་བོ་བྱེད་ཀི་ཡོད་ས་མ་རེད་ཡོད་བ།
STT_NS_M0191_0108_1345930_to_1349940,ནམ་རྒྱུན་ཡིན་ན་སྤྱི་ཟླ་ང་ཚོ་ལྔ་བ་སི་དེ་ནས་མར་རླུང་པོ་ཡ་ཡུད་ཤུགས་ཆེན་པོ་རྒྱག་གི་རེད་དཱ་རཱ།  ,nam rgyun yin na spyi zla nga tsho lnga ba si de nas mar rlung po ya yud shugs chen po rgyag gi red dA rA/__,https://d38pmlk0v88drf.cloudfront.net/wav16k/STT_NS_M0191_0108_1345930_to_1349940.wav,STT_NS,3,91,4.01,wav16k/STT_NS_M0191_0108_1345930_to_1349940.wav,ནམ་རྒྱུན་ཡིན་ན་སྤྱི་ཟླ་་ང་ཚོ་ལྔ་བ་སི་དེ་མར་ཨེ་ནས་རླུང་པོ་ཡ་ཡུད་ཤུགས་ཆེན་པོ་རྒྱག་གི་རེད་ད་རཱ།
STT_NS_M0236_0127_753265_to_755576,ག་བར་རྒྱུག་ན་རྒྱུག་ལབ་སོང་ཡོད་བ་ཡ་མེད་རེད་ཤག་ང་ཚོ་ད་ཡ།  ,ga bar rgyug na rgyug lab song yod ba ya med red shag nga tsho da ya/__,https://d38pmlk0v88drf.cloudfront.net/wav16k/STT_NS_M0236_0127_753265_to_755576.wav,STT_NS,3,56,2.311,wav16k/STT_NS_M0236_0127_753265_to_755576.wav,ག་བ་རྒྱུགས་ན་རྒྱུགས་ལབ་སོང་ཡོད་བ། ཡ་མེད་རེད་ཤག་ང་ཚོ་ད་ཡོད་བ།
STT_NS_M0192_0098_874889_to_884889,ཡིན་ནས་ཡོད་རཱ། འབྲེལ་བ་ཅི་ཡང་མི་རྒྱོ་སྐོར་ལ་ད་ལབ་བསྡད་ནས་ད་སྐྱིད་པོ་ཁོ་རང་ད་བྱུང་ས་མ་རེད་ང་ནི། མོ་གཅིག་མོ་གཉིས་རེད་མོ་གསུམ་རེད་མོ་བཞི་རེད་མོ་སྔོན་མ་ཨེ་འདྲའི་རེད། མོ་གིས་སྔོན་མ་གཅིག་གཅིག་གཅིག་རེད།  ,yin nas yod rA/_'brel ba ci yang mi rgyo skor la da lab bsdad nas da skyid po kho rang da byung sa ma red nga ni/_mo gcig mo gnyis red mo gsum red mo bzhi red mo sngon ma e 'dra'i red/_mo gis sngon ma gcig gcig gcig red/__,https://d38pmlk0v88drf.cloudfront.net/wav16k/STT_NS_M0192_0098_874889_to_884889.wav,STT_NS,3,197,10.0,wav16k/STT_NS_M0192_0098_874889_to_884889.wav,ཡིན་ནས་ཡོད་རཱ། འབྲེལ་བ་གཅིག་ཡ་མེད་རྒྱོ་སྐོར་ལ་ད་ལབ་བསྡད་ན་ད་སྐྱིད་པོ་ཁོ་རང་བྱུང་ས་མ་ང་ནི། མོ་གཅིག་མོ་གཉིས་རེད། མོ་གསུམ་རེད།མོ་བཞི་རེད། མོ་སྔོན་མ་ཨེ་འདྲའི་རེད། མོ་གཉིས་སྔོན་མ་གཅིག་གཅིག་གཅིག་རེད།
STT_NS_M0195_0522_3542483_to_3548575,སེམས་པ་སྐྱོ་དགོས་ཡ་འདྲ་བོ་ཡོད་མ་རེད་ཡོད་བ། སོ་སོ་ག་རེ་ལབ་དགོས་རེད་ད་ང་རང་ཚོ་ག་རེ་བསམ་གི་ཡོད་ནས་རཱ་བསམ་བཅུག་ཡ་རེད་ད།  ,sems pa skyo dgos ya 'dra bo yod ma red yod ba/_so so ga re lab dgos red da nga rang tsho ga re bsam gi yod nas rA bsam bcug ya red da/__,https://d38pmlk0v88drf.cloudfront.net/wav16k/STT_NS_M0195_0522_3542483_to_3548575.wav,STT_NS,3,117,6.092,wav16k/STT_NS_M0195_0522_3542483_to_3548575.wav,སེམས་པ་སྐྱོ་དགོས་ཡ་འདྲ་བོ་ཡོད་མ་རེད་ཡོད་བ། སོ་སོ་་ག་རེ་ལབ་དགོས་རེད་ད། ངོ་རང་ཚོ་ག་རེ་བསམ་གི་ཡོད་ནས་རཱ་བསམ་བཅུག་ཡ་རེད་ད།
STT_NS_M0194_0362_2553233_to_2559684,ཨེ་འདྲའི་འདྲ་བོ་ཅིག་རེད་ཤག་ཡོད་བ། གཞན་པ་ད་ང་འགྲོ་རྒྱོ་འདྲ་བོ་དྲན་པ་གསོ་ཡི་མི་འདུག ཨ་ནས་ད་གཙོ་བོ་གཙོ་བོ་ད་ག་རེ་ལབ་དགོས་རེད།  ,e 'dra'i 'dra bo cig red shag yod ba/_gzhan pa da nga 'gro rgyo 'dra bo dran pa gso yi mi 'dug_a nas da gtso bo gtso bo da ga re lab dgos red/__,https://d38pmlk0v88drf.cloudfront.net/wav16k/STT_NS_M0194_0362_2553233_to_2559684.wav,STT_NS,3,124,6.451,wav16k/STT_NS_M0194_0362_2553233_to_2559684.wav,ཨེ་འདྲའི་འདྲ་བོ་ཅིག་རེད་ཤག་རཱ། གཞན་པ་ད་ང་འགྲོ་རྒྱོ་འདྲ་བོ་དྲན་པ་སོས་ཀི་མི་འདུག ཨེ་ནས་ད་གཙོ་བོ་གཙོ་བོ་ད་ག་རེ་ལབ་དགོས་རེད།
STT_NS_M0196_0324_3576623_to_3578736,དེ་འདྲའི་མི་ལ་དབྱེ་འབྱེད་འདྲ་བོ་བྱེད་ཀི་ཡོད་བ་ཡིན་ན།  ,de 'dra'i mi la dbye 'byed 'dra bo byed ki yod ba yin na/__,https://d38pmlk0v88drf.cloudfront.net/wav16k/STT_NS_M0196_0324_3576623_to_3578736.wav,STT_NS,3,54,2.113,wav16k/STT_NS_M0196_0324_3576623_to_3578736.wav,དེ་འདྲའི་མི་ལ་དབྱེ་འབྱེད་འདྲ་བོ་བྱེད་ཀི་ཡོད་བ་ཡིན་ན།
STT_NS_M0193_0310_2344749_to_2347454,འདི་ཡོད་རཱ་ཡག་ཤོས་སྐྱིད་ཤོས་འདྲ་བོ་ཅིག་ཚོར་སོང་རཱ།  ,'di yod rA yag shos skyid shos 'dra bo cig tshor song rA/__,https://d38pmlk0v88drf.cloudfront.net/wav16k/STT_NS_M0193_0310_2344749_to_2347454.wav,STT_NS,3,52,2.705,wav16k/STT_NS_M0193_0310_2344749_to_2347454.wav,འདི་ཡོད་རཱ་ཡག་ཤོས་སྐྱིད་ཤོས་འདྲ་བོ་ཅིག་ཚོར་སོང་རཱ།
STT_NS_M0185_0349_3249854_to_3257960,སྤྱིར་བཏང་གི་ད་ཡུ་ཋུབ་སྡིངས་ཆ་དེ་ཚོ་ད་དྲང་པོ་བཤད་ན། གོ་སྐབས་ལེན་པ་ཡིན་ན་ད་གོ་སྐབས་ཆུང་ཆུང་རེད། སྡེངས་ཆ་དེ་ད་སྡིངས་ཆ་ཆེན་པོ་རེད་དཱ། དྲང་པོ་བཤད་ན་མི་མང་པོས་མཐོང་ཐུབ་ཡ་གི་སྡིངས་ཆ་རཱ།  ,spyir btang gi da yu Thub sdings cha de tsho da drang po bshad na/_go skabs len pa yin na da go skabs chung chung red/_sdengs cha de da sdings cha chen po red dA/_drang po bshad na mi mang pos mthong thub ya gi sdings cha rA/__,https://d38pmlk0v88drf.cloudfront.net/wav16k/STT_NS_M0185_0349_3249854_to_3257960.wav,STT_NS,3,181,8.106,wav16k/STT_NS_M0185_0349_3249854_to_3257960.wav,སྤྱིར་བཏང་གི་ད་ཡུ་ཋུབ་སྡིངས་ཆ་དེ་ཚོ་ད་དྲང་པོ་བཤད་ན་ གོ་སྐབས་ལེན་པ་ཡིན་ན་ད་གོ་སྐབས་ཆུང་ཆུང་རེད། སྡིངས་ཆ་འདི་ད་སྡིངས་ཆ་ཆེན་པོ་རེད་ད་དྲང་པོ་བཤད་ན་མི་མང་པོ་མཐོང་ཐུབ་ཡ་གི་སྡིངས་ཆ་རཱ།
STT_TT00653_0339_3215452_to_3218267,གནོད་པའམ། འཚེ་བར་འདོད་པའི་བློ་རེད་བ།  ,gnod pa'am/_'tshe bar 'dod pa'i blo red ba/__,https://d38pmlk0v88drf.cloudfront.net/wav16k/STT_TT00653_0339_3215452_to_3218267.wav,STT_TT,3,38,2.815,wav16k/STT_TT00653_0339_3215452_to_3218267.wav,གནོད་པའམ་འཚེ་བར་འདོད་པའི་བློ་རེད་བ།
STT_NS_M0188_0105_1078097_to_1084598,ད་ང་རང་ད་ལྟ་ལས་ཀ་བྱེད་ཀི་ཡོད་རཱ་ད་སྨོན་ལམ་ནང་ལོགས་ལ། ཨེ་ནས་གཞི་ནས་ཚོར་ཡ་ཅིག་ཡོད་བ། པེ་ཤ་ལབ་ཡ་དེ་ག་འདྲ་གལ་ཆེན་པོ་རེད་འདུག་རཱ། ཡིན་ནས་ང་།  ,da nga rang da lta las ka byed ki yod rA da smon lam nang logs la/_e nas gzhi nas tshor ya cig yod ba/_pe sha lab ya de ga 'dra gal chen po red 'dug rA/_yin nas nga /__,https://d38pmlk0v88drf.cloudfront.net/wav16k/STT_NS_M0188_0105_1078097_to_1084598.wav,STT_NS,3,137,6.501,wav16k/STT_NS_M0188_0105_1078097_to_1084598.wav,ད་ང་རང་ད་ལྟ་ལས་ཀ་བྱེད་ཀི་ཡོད་རཱ། ད་སྨོན་ལམ་ནང་ལོགས་ལ་ ཨེ་ནས་གཞི་ནས་ཚོར་ཡ་ཅིག་ཡོད་བ། པེ་ཤ་ལབ་ཡ་དེ་ག་འདྲའི་གལ་ཆེན་པོ་རེད་འདུག་རཱ། ཡིན་ནས་ང་།
STT_NS_M0185_0258_2347414_to_2354360,གདོང་དེ་ལ་མ་རེད། གདོང་དེ་ལ་བུ་མོ་གཉིས་བསྡད་ཀི་རེད། རྒྱབ་དེ་ལ་བུ་གཉིས་བསྡད་ཀི་རེད། གཡས་དེ་ལ་བུ་མོ་གཉིས་བསྡད་ཀི་རེད། གཡོན་དེ་ལ་བུ་གཉིས་བསྡད་ཀི་རེད།  ,gdong de la ma red/_gdong de la bu mo gnyis bsdad ki red/_rgyab de la bu gnyis bsdad ki red/_g.yas de la bu mo gnyis bsdad ki red/_g.yon de la bu gnyis bsdad ki red/__,https://d38pmlk0v88drf.cloudfront.net/wav16k/STT_NS_M0185_0258_2347414_to_2354360.wav,STT_NS,3,147,6.946,wav16k/STT_NS_M0185_0258_2347414_to_2354360.wav,གདོང་དེ་ལ་མ་རེད། གདོང་དེ་ལ་བུ་མོ་གཉིས་བསྡད་ཀི་རེད། རྒྱབ་དེ་ལ་བུ་གཉིས་བསྡད་ཀི་རེད། གཡས་དེ་ལ་བུ་མོ་གཉིས་བསྡད་ཀི་རེད། གཡོན་དེ་ལ་བུ་གཉིས་བསྡད་ཀི་རེད།
STT_NS_M0195_0398_2623340_to_2627567,ཨེ་ནས་ཨོ་དེ་ཡིས་ཨ་རི་ལ་ད་འགྲོ་ཡ་ད་འདོད་པ་ཡོད་ད་རཱ། ཨེ་ནས་ངེད་ཀ་ཅི་དམིགས་ཡུལ་འདྲ་བོ་དེ་རེད་འདུག་ད་རཱ།  ,e nas o de yis a ri la da 'gro ya da 'dod pa yod da rA/_e nas nged ka ci dmigs yul 'dra bo de red 'dug da rA/__,https://d38pmlk0v88drf.cloudfront.net/wav16k/STT_NS_M0195_0398_2623340_to_2627567.wav,STT_NS,3,102,4.227,wav16k/STT_NS_M0195_0398_2623340_to_2627567.wav,ཨེ་ནས་ཨོ་འདི་ཨ་རི་ལ་ད་འགྲོ་ཡ་ད་འདོད་པ་ཡོད་ད་རཱ། ཨེ་ནས་ངའི་ཀ་ཅི་དམིགས་ཡུལ་འདྲ་བོ་རེད་འདུག་ད་རཱ།
STT_NS_M0194_0426_3162204_to_3165385,དེ་ལ་ཨེ་ནས་ང་ཚོས་ཁ་ལག་འདྲ་བོ་ཟ་ཨེ་འདྲའི་འདྲ་བོ་བྱས་ཡིན། ཨེ་ནས་ཁ་ལག་ ,de la e nas nga tshos kha lag 'dra bo za e 'dra'i 'dra bo byas yin/_e nas kha lag _,https://d38pmlk0v88drf.cloudfront.net/wav16k/STT_NS_M0194_0426_3162204_to_3165385.wav,STT_NS,3,68,3.181,wav16k/STT_NS_M0194_0426_3162204_to_3165385.wav,དི་ལ་ཨེ་ནས་ང་ཚོ་ཁ་ལག་འདྲ་བོ་ཟ་ཨེ་འདྲའི་འདྲ་བོ་བྱས་ཡིན། ཨེ་ནས་ཁ་ལག་
STT_TT00035_11995.900-11998.400,རྒྱུ། དེ་བྱུང་ན་དེ་ལ་གནས་པ། དེ་ལ་བརྟེན་པས།  ,rgyu/_de byung na de la gnas pa/_de la brten pas/__,https://d38pmlk0v88drf.cloudfront.net/wav16k/STT_TT00035_11995.900-11998.400.wav,STT_TT,3,44,2.5,wav16k/STT_TT00035_11995.900-11998.400.wav,རྒྱུའོ། དེ་བྱུང་ན་དེ་ལ་གནས་པ་དེ་ལ་བརྟེན་པས།
STT_NS_M0202_0259_1938848_to_1945656,མོ་ཊ་དཔེ་མགྱོགས་པོ་འདྲ་བོ་བཏང་བ་ཡིན་ན་ལབ་ཡིན་ད་རཱ། སོ་སོ་གཅིག་པོ་ལ་གནོད་སྐྱེལ་གི་མ་རེད་ཡོད་བ། དེ་མི་གཞན་པ་ལ་ཡང་གནོད་སྐྱེལ་གི་རེད།  ,mo Ta dpe mgyogs po 'dra bo btang ba yin na lab yin da rA/_so so gcig po la gnod skyel gi ma red yod ba/_de mi gzhan pa la yang gnod skyel gi red/__,https://d38pmlk0v88drf.cloudfront.net/wav16k/STT_NS_M0202_0259_1938848_to_1945656.wav,STT_NS,3,131,6.808,wav16k/STT_NS_M0202_0259_1938848_to_1945656.wav,མོ་ཊ་དཔེ་མགྱོགས་པོ་འདྲ་བོ་བཏང་བ་ཡིན་ན་ལབ་ཡིན་ད་རཱ། སོ་སོ་གཅིག་པོ་ལ་གནོད་སྐྱེལ་གི་མ་རེད་ཡོད་བ། དེ་མི་གཞན་པ་ལ་ཡང་གནོད་སྐྱེལ་གི་རེད།
STT_NS_M0195_0761_5158970_to_5161454,ཨེ་ནས་ཡང་མིན་ན་ཡང་བུ་མོ་ཁ་ཤས་ཕྱི་ལོགས་འགྲོ་ཡ་དགའ་བོ་འདུག་བ་ཡང་།  ,e nas yang min na yang bu mo kha shas phyi logs 'gro ya dga' bo 'dug ba yang /__,https://d38pmlk0v88drf.cloudfront.net/wav16k/STT_NS_M0195_0761_5158970_to_5161454.wav,STT_NS,3,65,2.484,wav16k/STT_NS_M0195_0761_5158970_to_5161454.wav,ཨེ་ནས་ཡང་མིན་ན་ཡང་བུ་མོ་ཁ་ཤས་ཕྱི་ལོགས་འགྲོ་ཡ་དགའ་བོ་འདུག་བ་ཡང་།
STT_TT00038_00583.200-00583.950,གང་ལྟར་ཨེ་ནས།  ,gang ltar e nas/__,https://d38pmlk0v88drf.cloudfront.net/wav16k/STT_TT00038_00583.200-00583.950.wav,STT_TT,3,15,0.75,wav16k/STT_TT00038_00583.200-00583.950.wav,གང་ལྟར་ཨེ་ནས།
