file_name,uni,wylie,url,dept,grade,char_len,audio_len,path,inf
STT_TT00306_336.400-342.050,ད་ད་ག་ནང་བཞིན་སེམས་ཅན་ལ་སྙིང་རྗེ་སྒོམ། ང་ཚོས་ལྟོ་དེ་འདྲའི་སྟེར། གཡོག་བྱེད་ཡག་པོ་རྒྱུགས། དེ་འདྲས་བྱས་པ་ལ་བརྟེན་ནས། ཡང་ཡག་པོ་ཞེ་བོ་ཅིག་ཡོང་གི་འདུག་གཱ།  ,da da ga nang bzhin sems can la snying rje sgom/_nga tshos lto de 'dra'i ster/_g.yog byed yag po rgyugs/_de 'dras byas pa la brten nas/_yang yag po zhe bo cig yong gi 'dug gA/__,https://d38pmlk0v88drf.cloudfront.net/wav16k/STT_TT00306_336.400-342.050.wav,STT_TT,3,150,5.650000000000034,wav16k/STT_TT00306_336.400-342.050.wav,ད་ད་ག་ནང་བཞིན་སེམས་ཅན་ལ་སྙིང་རྗེ་སྒོམ། ང་ཚོས་ལྟོ་དེ་འདྲས་བསྟན། གཡོ་བྱི་ཡག་པོ་རྒྱུགས། དེ་འདྲསི་བྱས་པ་ལ་བརྟེན་ནས་ཡང་ཡག་པོ་ཞེ་བོ་ཅིག་ཡོང་གི་འདུག་ག།
STT_TT00302_167.100-174.500,གོན་རྒྱུ་ཕུལ། ཁ་བཏགས་ཕུལ། དེ་བྱས་ན་བླ་མ་ཐུགས་མཉེས་ཀི་མ་རེད། དེ་འདྲའི་ཐུགས་མཉེས། མཉེས་མྱི་གཅིག་གི་བླ་མ་གཅིག་ཡོད་པ་ན་ལས། དེ་བླ་མ་དེ་བླ་མ་སྐྱག་རྫུན་ཡིན་པའི་རྟགས་རེད་མ་གཏོགས། བླ་མ་ངོ་མ་ངོ་རྟགས་མིན་པའི་རྟགས་རེད།  ,gon rgyu phul/_kha btags phul/_de byas na bla ma thugs mnyes ki ma red/_de 'dra'i thugs mnyes/_mnyes myi gcig gi bla ma gcig yod pa na las/_de bla ma de bla ma skyag rdzun yin pa'i rtags red ma gtogs/_bla ma ngo ma ngo rtags min pa'i rtags red/__,https://d38pmlk0v88drf.cloudfront.net/wav16k/STT_TT00302_167.100-174.500.wav,STT_TT,3,208,7.400000000000006,wav16k/STT_TT00302_167.100-174.500.wav,གོང་རྒྱུ་ཕུལ། ཁ་བཏགས་ཕུལ། དེ་བྱས་ནས་བླ་མ་ཐུགས་མྙེད་ཀི་མ་རེད། དེ་འདྲས་ཐུག་མཉེར་མཉེར་མྱི་གི་བླ་མ་གཅིག་ཡོད་པ་ཡིན་ན་ལས། དེ་བླ་མ་དེ་བླ་མ་རྡོ་རྫིན་ཡིན་པའི་རྟགས་རེད་མ་གཏོགས། བླ་མ་ངོ་མ་གོང་རྟགས་ཅིག་མེད་འི་རྟགས་རེད།
STT_TT00300_00363.450-00364.650,དེ་བྱེད་དུས་མ་གཏོགས། དམིགས་བསལ་མར།  ,de byed dus ma gtogs/_dmigs bsal mar/__,https://d38pmlk0v88drf.cloudfront.net/wav16k/STT_TT00300_00363.450-00364.650.wav,STT_TT,3,36,1.1999999999999886,wav16k/STT_TT00300_00363.450-00364.650.wav,དེད་རྒྱུ་རེད་མ་གཏོགས། དམིགས་བསལ་མར།
STT_TT00037_07226.100-07227.150,དེ་བཞིན་ཁྱད་པར་འགྲོ་བ་དང་།  ,de bzhin khyad par 'gro ba dang /__,https://d38pmlk0v88drf.cloudfront.net/wav16k/STT_TT00037_07226.100-07227.150.wav,STT_TT,3,28,1.0499999999992724,wav16k/STT_TT00037_07226.100-07227.150.wav,དེ་བཞིན་ཁྱད་པར་འགྲོ་བ་དང་།
STT_TT00400_234.900-236.800,དེ་ལ་བཙོག་སྣང་སྐྱེ་རྒྱུ་ཕར་བཞག་བྱས། དེ་ལ་ད་དུང་ཆགས ,de la btsog snang skye rgyu phar bzhag byas/_de la da dung chags_,https://d38pmlk0v88drf.cloudfront.net/wav16k/STT_TT00400_234.900-236.800.wav,STT_TT,3,51,1.9000000000000057,wav16k/STT_TT00400_234.900-236.800.wav,དེ་ལ་བཙོང་སྣང་སྐྱེ་རྒྱུ་ཕར་བཞག་བྱས། དེ་ལ་ད་དུང་ཆག།
STT_TT00039_06061.750-06063.250,ཨེ་ནས། འཛམ་བུ་གླིང་གི་རྙོག་དྲ་དེ་གས་དེ།  ,e nas/_'dzam bu gling gi rnyog dra de gas de/__,https://d38pmlk0v88drf.cloudfront.net/wav16k/STT_TT00039_06061.750-06063.250.wav,STT_TT,3,41,1.5,wav16k/STT_TT00039_06061.750-06063.250.wav,ཨེ་ནས་ འཛམ་བུ་གླིང་གི་རྙོག་དྲ་འདེ་གས་འདེ།
STT_TT00390_126.200-129.300,བྱས་ཙང་། ངས་ལོ་གསུམ་བཞི་ཅིག་སྔོན་ནས་རེད། ད་ཕལ་ཆེར་ལོ་གསུམ་བཞི་ཅིག་རེད། དེའི་སྔོན་ནས།  ,byas tsang /_ngas lo gsum bzhi cig sngon nas red/_da phal cher lo gsum bzhi cig red/_de'i sngon nas/__,https://d38pmlk0v88drf.cloudfront.net/wav16k/STT_TT00390_126.200-129.300.wav,STT_TT,3,86,3.1000000000000085,wav16k/STT_TT00390_126.200-129.300.wav,བྱས་ཙང་ངས་ལོ་གསུམ་བཞི་ཅིག་སྔོན་ནས་རེད། ད་ཕལ་ཆེར་ལོ་གསུམ་བཞི་ཅིག་རེད། དེའི་སྔོན་ནས།
STT_TT00305_785.000-793.150,ཅིག་མིང་དེ་ལ་ཡང་མི་ལུས་རིན་པོ་ཆེ་སེ་བཏགས། ཨེ་ནས། བསམ་བློ་གཏོང་སྟངས་དང་ལས་ཀ་བྱེད་སྟངས་དང་འདི་ཚོ་གང་ག་བ་ཕྱུག་གློང་ངེའི་ཟོལ་འདྲ་ཅིག་འ་གོ་མེད་པའི་ཟོལ་འདྲ་ཅིག་སྡོད་དང་། ཨེ་ནས། ཁྱད་མཚར་ཞེ་བོ་ཅིག་ཆགས་པ་རེད།  ,cig ming de la yang mi lus rin po che se btags/_e nas/_bsam blo gtong stangs dang las ka byed stangs dang 'di tsho gang ga ba phyug glong nge'i zol 'dra cig 'a go med pa'i zol 'dra cig sdod dang /_e nas/_khyad mtshar zhe bo cig chags pa red/__,https://d38pmlk0v88drf.cloudfront.net/wav16k/STT_TT00305_785.000-793.150.wav,STT_TT,3,201,8.149999999999977,wav16k/STT_TT00305_785.000-793.150.wav,ཅིག་མིང་དེ་ལ་ཡ་མི་ལུས་རིན་པོ་ཆེ་བཏགས། ཨེ་ནས་བསམ་བློ་གཏོང་སྟངས་དང་ལས་ཀ་བྱེད་སྟངས་དང་། དེ་ཚོ་གང་ག་དཔེ་བ་ཕྱུགས་རང་གི་ཟོལ་ཅིག དང་གུ་མེད་པའི་ཟོལ་བྱས་སྡོད་དང། ཨེ་ནས་ཁྱད་མཚར་ཞེ་བོ་ཆགས་པོ་རེད།
STT_TT00304_1434.250-1437.300,དེ་ཕྱིར་སེམས་ལྡན་སེམས་ཅན་ཞིང་དང་ནི། རྒྱལ་བའི་ཞིང་ཞེས་ཐུབ་པས་གསུངས། སེ་བྱས།  ,de phyir sems ldan sems can zhing dang ni/_rgyal ba'i zhing zhes thub pas gsungs/_se byas/__,https://d38pmlk0v88drf.cloudfront.net/wav16k/STT_TT00304_1434.250-1437.300.wav,STT_TT,3,76,3.0499999999999545,wav16k/STT_TT00304_1434.250-1437.300.wav,དེ་ཕྱིར་སེམས་ལྡན་སེམས་ཅན་ཞིང་དང་ནི། རྒྱལ་བའི་ཞིང་ཞེས་ཐུབ་པས་གསུངས། བྱས།
STT_TT00304_355.250-360.100,གསུངས། ག་རེ་ཟེར་དགོས་རེད། ཅིག་གནོད་པ་སྐྱེལ། རྣམ་འགྱུར་བསྟན་དེ་འདྲའི་བྱེད་མྱི་གི་དགྲ་དེ་ལ་ཡ་བརྒྱ་ཆ་བརྒྱ་ཐམ་པ་ད་ཁོའི་སྒང་ལ་གཡོག་ཡ་ཅི་ཡང་མི་འདུག ,gsungs/_ga re zer dgos red/_cig gnod pa skyel/_rnam 'gyur bstan de 'dra'i byed myi gi dgra de la ya brgya cha brgya tham pa da kho'i sgang la g.yog ya ci yang mi 'dug_,https://d38pmlk0v88drf.cloudfront.net/wav16k/STT_TT00304_355.250-360.100.wav,STT_TT,3,142,4.850000000000023,wav16k/STT_TT00304_355.250-360.100.wav,གསུང་། ག་རེ་ཟེར་དགོས་རེད།ཅིག་གནོད་པ་སྐྱལ། རྣམ་འགྱུར་བསྟན། དེ་འདྲས་བྱེད་མྱི་གི་དགྲ་དེ་ལ་ཡ། བརྒྱ་ཆ་བརྒྱ་ཐམ་ད་ཁོའི་སྒང་ལ་ཡོང་ཡ་ཅང་མི་འདུག
STT_TT00305_427.600-430.850,ཨེ་ནས་དེ་ད་ལྟ་ང་རང་ཚོའི་དགོན་པའི་ནང་ལ་ཚུར་ཁུར་ཡོང་བྱས། ཨེ་ནས་ཁ་ལ་རག་བྱས་ང་ཚོས་བཏུང་གི་ཡོད་རེད་བ་ ,e nas de da lta nga rang tsho'i dgon pa'i nang la tshur khur yong byas/_e nas kha la rag byas nga tshos btung gi yod red ba _,https://d38pmlk0v88drf.cloudfront.net/wav16k/STT_TT00305_427.600-430.850.wav,STT_TT,3,97,3.25,wav16k/STT_TT00305_427.600-430.850.wav,ཨེ་ནས་དེ་ད་ལྟ་ང་རང་ཚོ་དགོན་པའི་ནང་ཚུར་ཁྱེར་ཡོང་བྱས། ཨེ་ནས་ཁ་ལོ་རག་བྱས་ང་ཚོས་བཏུང་གི་ཡོད་རེད་བ།
STT_TT00307_00510.650-00513.300,པུ་གུ་ཡར་གཅིག་གཟུགས་པོ་མ་ཚར་བར་དུ། པུ་གུ་དང་ཨ་མའི་བར་ཚགས་ལ་གཅིག ,pu gu yar gcig gzugs po ma tshar bar du/_pu gu dang a ma'i bar tshags la gcig_,https://d38pmlk0v88drf.cloudfront.net/wav16k/STT_TT00307_00510.650-00513.300.wav,STT_TT,3,64,2.6499999999999773,wav16k/STT_TT00307_00510.650-00513.300.wav,པུ་གུ་ཡར་ཅིག་གཟུགས་པོ་མ་ཚང་བར་དུ་ པུ་གུ་དང་ཨ་མའི་བར་ཚགས་ལ་རྩིས་
STT_TT00307_00411.150-00416.550,གང་ལྟར། སངས་རྒྱས་ལ་བསྟེན་ནས་སངས་རྒྱས་གོ་འཕང་ཐོབ་ཡ་འདུག སེམས་ཅན་ལ་བསྟེན་ནས་སེམས་ཅན་གོ་འཕང་ཐོབ་ཡ་འདུག དེ་སོང་ཙང་སེམས་ཅན་དང་སངས་རྒྱས་གཉིས་པོ་ད་རྩ་ཆེ་ལོད་ ,gang ltar/_sangs rgyas la bsten nas sangs rgyas go 'phang thob ya 'dug_sems can la bsten nas sems can go 'phang thob ya 'dug_de song tsang sems can dang sangs rgyas gnyis po da rtsa che lod _,https://d38pmlk0v88drf.cloudfront.net/wav16k/STT_TT00307_00411.150-00416.550.wav,STT_TT,3,151,5.400000000000034,wav16k/STT_TT00307_00411.150-00416.550.wav,གང་ལྟར་སངས་རྒྱས་ལ་བརྟེན་ནས་སངས་རྒྱས་གོ་འཕང་ཐོབ་ཡ་འདུག སེམས་ཅན་ལ་བརྟེན་ནས་སེམས་རྒྱས་གོ་འཕང་ཐོབ་ཡ་འདུག དེ་སོང་ཙང་སེམས་ཅན་དེ་སངས་རྒྱས་གཉིས་པོ་འདེ་ད་རྩ་ཆེན
STT_TT00308_1055.250-1057.650,ད་རིག་པ་ཡག་པོ་འདུག་ན་རིག་པ་འཕྲོ་བརླག་གཏང་མཁན་དེ་ཕང་ཡག་རེད་ཤག ,da rig pa yag po 'dug na rig pa 'phro brlag gtang mkhan de phang yag red shag_,https://d38pmlk0v88drf.cloudfront.net/wav16k/STT_TT00308_1055.250-1057.650.wav,STT_TT,3,61,2.400000000000091,wav16k/STT_TT00308_1055.250-1057.650.wav,ད་རིག་པོ་ཡག་པོ་འདུག་ད་རིག་པ་འཕྲོ་བརླག་བཏང་ན་དེ་ཕར་ཡང་རེད་ཤག
STT_TT00305_82.600-85.300,སོ་སོ་མ་གཏོགས་པའི་མི་དང་། དུད་འགྲོ་དང་། འབུ་སྲིན་དང་།  ,so so ma gtogs pa'i mi dang /_dud 'gro dang /_'bu srin dang /__,https://d38pmlk0v88drf.cloudfront.net/wav16k/STT_TT00305_82.600-85.300.wav,STT_TT,3,55,2.700000000000003,wav16k/STT_TT00305_82.600-85.300.wav,སོ་སོ་མ་གཏོགས་པའི་མི་དང་དུད་འགྲོ་དང་འབུ་སྲིན་དང་།
STT_TT00301_516.500-518.800,གང་ག་དེ་བར་གཅིག དཔག་བསམ་གི་ཤིང་དང་དེ་འདྲའི་གི་ཐོག་ནས་ཁ་ཐུག ,gang ga de bar gcig_dpag bsam gi shing dang de 'dra'i gi thog nas kha thug_,https://d38pmlk0v88drf.cloudfront.net/wav16k/STT_TT00301_516.500-518.800.wav,STT_TT,3,59,2.2999999999999545,wav16k/STT_TT00301_516.500-518.800.wav,གང་ག་དེ་བ་ཅིག་དཔག་བསམ་གི་ཤིང་དང་དེ་འདྲའ་གི་ཐོག་ནས་ཁ་ཐུག
STT_TT00302_1059.950-1064.850,དགོན་པ་གཅིག་གཅིག་མ་མ་གཅིག་ལ་ཆོས་མཇལ་ལ་འགྲོ་ཨ། གཅིག་གཅིག་མ་མ་གཅིག་གནས་མཇལ་ལ་འགྲོ་ཨ་ཟེར། ད་དེ་འདྲའི་མ་ཟིན་མ་སླེབས་ན་ཁ་སྡིག་བསག་ཡོང་ཟེར་ཡ་འདུག་བ།  ,dgon pa gcig gcig ma ma gcig la chos mjal la 'gro a/_gcig gcig ma ma gcig gnas mjal la 'gro a zer/_da de 'dra'i ma zin ma slebs na kha sdig bsag yong zer ya 'dug ba/__,https://d38pmlk0v88drf.cloudfront.net/wav16k/STT_TT00302_1059.950-1064.850.wav,STT_TT,3,144,4.899999999999864,wav16k/STT_TT00302_1059.950-1064.850.wav,དགོན་པ་ཅིག་ཅིག་མར་མ་ཅིག་ཆོས་མཇལ་ལ་འགྲོ་ཨ། ཅིག་ཅིག་མར་མ་ཅིགལ། གནས་མཇལ་ལ་འགྲོ་ཡ་ཟོལ་། ད་དེ་འདྲའ་མ་ཟིན། མ་སླེབས་ན་ཁ་ཏིག་ས་རེད་ཟེར་ཡ་ཅིག་འདུག་ག།
STT_TT00304_1396.550-1398.150,དཀྲུག་མྱི་གང་ག་ཁོང་ཁྲོས་དཀྲུག་ཡོང་གི་འདུག ,dkrug myi gang ga khong khros dkrug yong gi 'dug_,https://d38pmlk0v88drf.cloudfront.net/wav16k/STT_TT00304_1396.550-1398.150.wav,STT_TT,3,42,1.6000000000001364,wav16k/STT_TT00304_1396.550-1398.150.wav,དཀྲུག་མྱི་གང་གཁོང་ཁྲོ་དཀྲུག་ཡོང་གི་འདུག་ག
STT_TT00303_303.300-311.950,ད་ང་ཚོ་ཁོང་ཁྲོ་སློང་མྱི་གཅིག ཁོང་ཁྲོ་དེ་སླེབ་ཡོང་དུས། ད་གནོད་པ་རྐྱེལ་མྱི་ཁོང་ཁྲོ་སྐྱེ་ཡོང་མྱི་དེ་ལ། ཁ་སུར་དེ་ང་ཚོས་བསམ་ཡོང་དུས། ཁོས་ངའི་གཅིག་འཚོ་བ་རེད། ཁོས་ངའི་ཅིག་མཚན་སྙན་གྲགས་རེད། དེ་ཚོ་གང་ག་ལ་ཡ།  ,da nga tsho khong khro slong myi gcig_khong khro de sleb yong dus/_da gnod pa rkyel myi khong khro skye yong myi de la/_kha sur de nga tshos bsam yong dus/_khos nga'i gcig 'tsho ba red/_khos nga'i cig mtshan snyan grags red/_de tsho gang ga la ya/__,https://d38pmlk0v88drf.cloudfront.net/wav16k/STT_TT00303_303.300-311.950.wav,STT_TT,3,199,8.649999999999977,wav16k/STT_TT00303_303.300-311.950.wav,ད་ང་ཚོས་ཁོང་ཁྲོ་སློང་མྱི་ཅིག་ཁོང་ཁྲོ་ཕར་ནས་ཚུར་ད་གནོད་པ་སྐྱེལ་ནས་ཁོང་ཁྲོ་སྐྱེལ་ཡོང་མྱི་དེ་ལ། ཁ་སུ་ང་ཚོས་བསམ་བློ་བཏང་ཡོང་དུས། ཁོས་ངའི་ཅིག་འཚོ་བ་རེད། ཁོས་ངའི་ཅིག་མཚན་སྙན་གྲགས་རེད། དེ་ཚོ་གང་ལ་ཡ།
STT_TT00304_1320.700-1323.350,ལུང་པའི་ནང་ལ་ངོ་ཚ་རྒྱུ་ལས་ཁུངས་ནང་ལ་ངོ་ཚ་རྒྱུ་གང་ག་ཁོང་ཁྲོ་དེས་བཟོ།  ,lung pa'i nang la ngo tsha rgyu las khungs nang la ngo tsha rgyu gang ga khong khro des bzo/__,https://d38pmlk0v88drf.cloudfront.net/wav16k/STT_TT00304_1320.700-1323.350.wav,STT_TT,3,69,2.649999999999864,wav16k/STT_TT00304_1320.700-1323.350.wav,ལུང་པའི་ནང་ལ་ངོ་ཚ་རྒྱུ། ལས་ཁུངས་ནང་ལ་ངོ་ཚ་རྒྱུ། གང་ག་ཁོང་ཁྲོ་དེ་སུ་
STT_TT00308_656.250-658.150,ད་དུང་ཐུབ་ཚོད་མ་བཤད་རོགས་བྱས་ན། ལྷ་རྒྱལ་རེད་མ་གཏོགས་གཅིག་གིས་ ,da dung thub tshod ma bshad rogs byas na/_lha rgyal red ma gtogs gcig gis _,https://d38pmlk0v88drf.cloudfront.net/wav16k/STT_TT00308_656.250-658.150.wav,STT_TT,3,62,1.8999999999999773,wav16k/STT_TT00308_656.250-658.150.wav,ད་དུང་ཐུབ་ཚོད་མ་བཤད་རོགས་བྱས་ན། ལྷ་རྐྱལ་རེད་མ་གཏོགས་
STT_TT00304_774.650-777.000,དེ་སོང་ཙང་ཁོང་ཁྲོ་བྱེད་ཡ་བསྡད་ཤོག་ཡོད་མ་རེད། རྩ་བ་ཉིད་ནས་ཁོང་ཁྲོ་བྱེད་ཡ་བསྡད་ཤག་ཡོད་མ་རེད།  ,de song tsang khong khro byed ya bsdad shog yod ma red/_rtsa ba nyid nas khong khro byed ya bsdad shag yod ma red/__,https://d38pmlk0v88drf.cloudfront.net/wav16k/STT_TT00304_774.650-777.000.wav,STT_TT,3,92,2.3500000000000227,wav16k/STT_TT00304_774.650-777.000.wav,དེ་སོང་ཙང་ཁོང་ཁྲོ་བྱེད་ཡ་བསྡད་བཞག་ཡོད་མ་རེད། རྩ་བ་ཉིད་ས་ཁོང་ཁྲོ་བྱེད་ཡ་བསད་བཞག་ཡོད་མ་རེད།
STT_TT00037_06667.700-06672.500,གཉིས་པ་འབྱུང་བ་འདི་ནི་དོན་མ་བྱས་པ་འགྱུར་རོ། ཡང་དེ་བཞིན་གཤེགས་པ་གཅིག་འཇིག་རྟེན་དུ་བྱུང་ན་སེམས་ཅན་རྣམས་ཀྱི་དོན་ ,gnyis pa 'byung ba 'di ni don ma byas pa 'gyur ro/_yang de bzhin gshegs pa gcig 'jig rten du byung na sems can rnams kyi don _,https://d38pmlk0v88drf.cloudfront.net/wav16k/STT_TT00037_06667.700-06672.500.wav,STT_TT,3,110,4.800000000000182,wav16k/STT_TT00037_06667.700-06672.500.wav,གཉིས་པ་འབྱུང་བ་ནི་ནི་དོན་པ་ཉིད་དུ་འགྱུར་རོ་ ཡང་། དེ་བཞིན་གཤེགས་པ་གཅིག་རཅིག་རྟེན་དུ་བྱུང་ན་སེམས་ཅན་རྣམས་ཀྱི་དོན་
STT_TT00415_270.300-273.750,ཁོ་ལ་མཁོ་ཆས་མེད་བསྡད་རྒྱོ། ཁོ་ལ་མ་དགོས་བཟོ་རའི་ཅ་ལག་ར་ཅིག་རེད་འདུག་ན། ངས་ཁོ་སྒྲུབ་ཀི་མིན།  ,kho la mkho chas med bsdad rgyo/_kho la ma dgos bzo ra'i ca lag ra cig red 'dug na/_ngas kho sgrub ki min/__,https://d38pmlk0v88drf.cloudfront.net/wav16k/STT_TT00415_270.300-273.750.wav,STT_TT,3,91,3.4499999999999886,wav16k/STT_TT00415_270.300-273.750.wav,ཁོ་ལ་ཁོ་བྱེད་མེད་བསྡད་རྒྱོ། ཁོ་ལ་མོ་དགོས་སོའི་ཅ་ལག་ཅིག་རེད་འདུག་ན། ངས་ཁོ་སྒྲུབ་ཀི་མིན།
STT_TT00308_35.100-38.300,ད་ང་ཚོ་སངས་རྒྱས་བཀའ་དྲིན་གསོ་ཡ་དེ་སྦྱང་དགོས་རེད། སངས་རྒྱས་ང་ཚོར་བཀའ་དྲིན་ཆེན་པོ་ཞེ་བོ་གཅིག་རེད་འདུག་བ།  ,da nga tsho sangs rgyas bka' drin gso ya de sbyang dgos red/_sangs rgyas nga tshor bka' drin chen po zhe bo gcig red 'dug ba/__,https://d38pmlk0v88drf.cloudfront.net/wav16k/STT_TT00308_35.100-38.300.wav,STT_TT,3,104,3.199999999999996,wav16k/STT_TT00308_35.100-38.300.wav,ད་ང་ཚོས་སངས་རྒྱས་བཀའ་དྲིན་ཟེར་ཡ་རྩིས་རྒྱབ་དགོས་རེད། སངས་རྒྱས་ང་ཚོར་བཀའ་དྲིན་ཆེན་པོ་ཞེ་བོ་ཅིག་རེད་འདུག་ག།
STT_TT00300_00016.400-00020.350,ད་སྣང་དག་མེད། སངས་རྒྱས་ལ་སྐྱབས་ནི་བཅོལ་བཞག་ཡོད། ཨེ་ནས་སངས་རྒྱས་ཀིས་སྐྱབས་ཀི་རེད། སྐྱོབ་ཡ་གི་ནུས་པ་ནི་ཡོད་རེད།  ,da snang dag med/_sangs rgyas la skyabs ni bcol bzhag yod/_e nas sangs rgyas kis skyabs ki red/_skyob ya gi nus pa ni yod red/__,https://d38pmlk0v88drf.cloudfront.net/wav16k/STT_TT00300_00016.400-00020.350.wav,STT_TT,3,111,3.950000000000003,wav16k/STT_TT00300_00016.400-00020.350.wav,ཨ་ནས་སྣང་དག་མེད།་སངས་རྒྱས་ལ་སྐྱབས་འགྲོ་བཅོལ་བཞག་ཡོད། ཨེ་ནས་སངས་རྒྱས་ཀིས་བསྐྱབས་ཀི་རེད། སྐྱབ་ཡ་གི་ནུས་པོ་དེ་ཡོད་རེད།
STT_TT00039_05976.150-05977.450,བཅོམ་ལྡན་འདས་ལ་ཡ་ཅིག་བཀའ་འདྲི་འདྲ་བོ་ཅིག་ ,bcom ldan 'das la ya cig bka' 'dri 'dra bo cig _,https://d38pmlk0v88drf.cloudfront.net/wav16k/STT_TT00039_05976.150-05977.450.wav,STT_TT,3,42,1.300000000000182,wav16k/STT_TT00039_05976.150-05977.450.wav,བཅོམ་ལྡན་འདས་ལ་ཡ་ཅིག་བཀའ་འདྲི་འདྲ་བོ་ཅིག
STT_TT00307_00009.100-00010.900,ཡོན་ཏན་རྒྱ་མཚོ་མཐའ་ཡས་པའི། སངས་རྒྱས་རྣམས་དང་འགའ་མཉམ།  ,yon tan rgya mtsho mtha' yas pa'i/_sangs rgyas rnams dang 'ga' mnyam/__,https://d38pmlk0v88drf.cloudfront.net/wav16k/STT_TT00307_00009.100-00010.900.wav,STT_TT,3,54,1.8000000000000007,wav16k/STT_TT00307_00009.100-00010.900.wav,ཡོན་ཏན་རྒྱ་མཚོ་མཐའ་ཡས་པའི། སངས་རྒྱས་མཉམས་དང་དགའ་ཉམ་།
STT_TT00301_468.850-472.350,འོ་ས་འདུས་སེ་རེད་གདའ། ད་འདི་ཡི་དྭགས་ལ་སྐྱེ་ཡ་དེ་རྒྱུ་གཙོ་བོ་དེ་སེར་སྣ་བྱེད་ཀི་སྡོད་ཡ་དེ་རེད།  ,'o sa 'dus se red gda'/_da 'di yi dwags la skye ya de rgyu gtso bo de ser sna byed ki sdod ya de red/__,https://d38pmlk0v88drf.cloudfront.net/wav16k/STT_TT00301_468.850-472.350.wav,STT_TT,3,94,3.5,wav16k/STT_TT00301_468.850-472.350.wav,འོ་ད་འདུག་སེ་རེད་ད། ད་འདི་ཡི་དྭགས་ལ་སྐྱེ་ཡ་གི་རྒྱུ་གཙོ་བོ་དེ་སེར་སྣ་བྱེད་ཀི་སྡོད་ཡ་དེ་རེད།
STT_TT00302_512.600-514.600,ཨེ་ནས། དེ་འདྲའི་ཐོག་ནས་ཕ་ཕྱོགས་དེ་དཀྲུག་ཡ་གི་ལས་ཀ་སྒང་ལ་ཕྱིན་སོང་ན།  ,e nas/_de 'dra'i thog nas pha phyogs de dkrug ya gi las ka sgang la phyin song na/__,https://d38pmlk0v88drf.cloudfront.net/wav16k/STT_TT00302_512.600-514.600.wav,STT_TT,3,69,2.0,wav16k/STT_TT00302_512.600-514.600.wav,ཨེ་ནས་དེ་འདྲའི་གི་ཐོག་ནས་ཕར་ཕྱོགས་དཀྲུག་ཡ་གི་ལས་ཀའི་སྒང་ལ་བྱེན་སུབ་ན།
STT_TT00304_25.950-28.200,ག་རེ་རེད་ཟེར་ན། ད་རེས་བཟོད་པའི་རྒྱུ་ཕུན་སུམ་ཚོགས་པོ་ཞེ་བོ།  ,ga re red zer na/_da res bzod pa'i rgyu phun sum tshogs po zhe bo/__,https://d38pmlk0v88drf.cloudfront.net/wav16k/STT_TT00304_25.950-28.200.wav,STT_TT,3,60,2.25,wav16k/STT_TT00304_25.950-28.200.wav,ག་རེ་རེད་ཟེར་ན། ད་རེས་བཟོད་པའི་རྒྱུ་ཕུན་སུམ་ཚོགས་པོ་ཞེ་བོག
