file_name,uni,wylie,url,dept,grade,char_len,audio_len,path,inf
STT_NS_M0188_0135_1447841_to_1452568,ཨོ་རེད། ཨེ་ནས་མཉམ་དུ་ང་རང་ཚོ་གི་རེད་བ་གལ་སྲིད་ད་ལྟ་ང་ཚོ་ལོ་ཆུང་ཆུང་སྐབས་སུ་ནས་ཡང་ ,o red/_e nas mnyam du nga rang tsho gi red ba gal srid da lta nga tsho lo chung chung skabs su nas yang _,https://d38pmlk0v88drf.cloudfront.net/wav16k/STT_NS_M0188_0135_1447841_to_1452568.wav,STT_NS,3,82,4.727,wav16k/STT_NS_M0188_0135_1447841_to_1452568.wav,ཨོ་རེད། ཨེ་ནས་མཉམ་དུ་ང་རང་ཚོ་གིས་རཱ། གལ་སྲིད་ད་ལྟ་ང་ཚོ་ལོ་ཆུང་ཆུང་སྐབས་སུ་ནས་ཡང་།
STT_NS_M0192_0359_3231544_to_3237977,མ་གཡུག་ད་སོ་སོ་ཡིས་རེད་བ། སོ་སོ་གིས་གད་སྣོད་ནང་ཏག་ཏག་བླུགས་དང་། གེ་མི་འདུག་བ་ལས་ཀ་དེ་ཚོ་ལས་སླ་བོ་རེད་བ་དྲང་མོ་བཤད་ན་ད།  ,ma g.yug da so so yis red ba/_so so gis gad snod nang tag tag blugs dang /_ge mi 'dug ba las ka de tsho las sla bo red ba drang mo bshad na da/__,https://d38pmlk0v88drf.cloudfront.net/wav16k/STT_NS_M0192_0359_3231544_to_3237977.wav,STT_NS,3,120,6.433,wav16k/STT_NS_M0192_0359_3231544_to_3237977.wav,མ་གཡུག་དང་སོ་སོ་ཡིས་རཱ་། སོ་སོ་གི་གད་སྣོད་ནང་ཏག་ཏག་བླུགས་དང་། གལ་མི་འདུག་བ་ལས་ཀ་དེ་ཚོ་ལས་སླ་བོ་རཱ་དྲང་པོ་བཤད་ན་ད།
STT_NS_M0193_0299_2287619_to_2291752,དམིགས་བསལ་ནང་མི་མཉམ་དུ་ཐུགས་སྤྲོ་བཏང་གར་འགྲོ་ཡ་ཡིན་ན་ད་ཆུའི་འགྲམ་ལ་འགྲོ་ན་དཔེ་སྐྱིད་པོ་ཡོད་རེད་རཱ།  ,dmigs bsal nang mi mnyam du thugs spro btang gar 'gro ya yin na da chu'i 'gram la 'gro na dpe skyid po yod red rA/__,https://d38pmlk0v88drf.cloudfront.net/wav16k/STT_NS_M0193_0299_2287619_to_2291752.wav,STT_NS,3,100,4.133,wav16k/STT_NS_M0193_0299_2287619_to_2291752.wav,དམིགས་བསལ་ནང་མི་མཉམ་དུ་ཐུག་སྤྲོ་བཏང་གར་འགྲོ་ཡ་ཡིན་ན་ ད་ཆུ་འགྲམ་ལ་འགྲོ་ན་དཔེ་སྐྱིད་པོ་ཡོད་རེད་རཱབ།
STT_NS_M0196_0022_148755_to_151297,ད་ལྟ་སྤྱི་ཚོགས་གྲལ་རིམ་ནང་ལོགས་ནས་ཨེ་ནས་ཆུང་ཤོས་ཅིག་ ,da lta spyi tshogs gral rim nang logs nas e nas chung shos cig _,https://d38pmlk0v88drf.cloudfront.net/wav16k/STT_NS_M0196_0022_148755_to_151297.wav,STT_NS,3,53,2.542,wav16k/STT_NS_M0196_0022_148755_to_151297.wav,ད་ལྟ་སྤྱི་ཚོགས་གྲལ་རིམ་ནང་ལོགས་ནས་ཨེ་ནས་ཆུང་ཤོས་ཅིག
STT_NS_M0187_0070_1009564_to_1015213,དཀའ་ངལ་ཡེ་ཡོད་རེད། སྐྱིད་པོ་ཡེ་ཡོད་རེད། དེ་དང་པོ་ང་ཚོ་ཁྲོམ་ལ་འགྲོ་བའི་སྐབས་སུ་ལག་པ་སྟོང་པར་འགྲོ་ཡི་རེད།  ,dka' ngal ye yod red/_skyid po ye yod red/_de dang po nga tsho khrom la 'gro ba'i skabs su lag pa stong par 'gro yi red/__,https://d38pmlk0v88drf.cloudfront.net/wav16k/STT_NS_M0187_0070_1009564_to_1015213.wav,STT_NS,3,105,5.649,wav16k/STT_NS_M0187_0070_1009564_to_1015213.wav,དཀའ་ངལ་ཡོད་རེད། སྐྱིད་པོ་ཡོད་རེད། ད་དང་པོ་ང་ཚོ་འཁྲོམ་ལ་འགྲོ་བའི་སྐབས་སུ་ལག་པ་སྟོང་པ་འགྲོ་གི་རེད།
STT_NS_M0200_0550_3790945_to_3794417,ད་གད་སྙིགས་གཡུག་བཞག་ཡ་ཞིག་ཡོད་བ་མི་ག་ཚོད་མི་དགོས་ག་ཚོད་ཡོད་བ་ཡིན་ན་ཡང་ཡོད་བ།  ,da gad snyigs g.yug bzhag ya zhig yod ba mi ga tshod mi dgos ga tshod yod ba yin na yang yod ba/__,https://d38pmlk0v88drf.cloudfront.net/wav16k/STT_NS_M0200_0550_3790945_to_3794417.wav,STT_NS,3,78,3.472,wav16k/STT_NS_M0200_0550_3790945_to_3794417.wav,ད་གད་སྙིགས་གཡུག་བཞག་ཡ་ཅིག་ཡོད་བ། མི་ག་ཚོད་མི་དགོས་ག་ཚོད་ཡོད་བ་ཡིན་ན་ཡང་ཡོད་བ།
STT_NS_M0189_0181_1614052_to_1622517,ཨེ་ནས་བསྐུར་པའི་སྐབས་སུ་ཨེ་ནས། ག་རེ་ལབ་དགོས་རེད་ད་པེ་ཤ་དེ་ཚོ་འཕྲོ་བརླག་བཏང་ཡ་གི་ཉེན་ཁ་ཡོད་རེད། ཨེ་ནས་སོ་སོ་པེ་དྲང་པོ་བཤད་ན་གཟབ་གཟབ་མ་བྱས་ན།  ,e nas bskur pa'i skabs su e nas/_ga re lab dgos red da pe sha de tsho 'phro brlag btang ya gi nyen kha yod red/_e nas so so pe drang po bshad na gzab gzab ma byas na/__,https://d38pmlk0v88drf.cloudfront.net/wav16k/STT_NS_M0189_0181_1614052_to_1622517.wav,STT_NS,3,141,8.465,wav16k/STT_NS_M0189_0181_1614052_to_1622517.wav,ཨེ་ནས་བསྐུར་བའི་སྐབས་སུ་ཨེ་ནས་ག་རེ་ལབ་དགོས་རེད་ད་ པེ་ཤག་དེ་ཚོ་འཕྲོ་བརླག་བཏང་ཡ་གི་ཉེན་ཁ་ཡོད་རེད། ཨེ་ནས་སོ་སོ་དཔེ་དྲང་པོ་བཤད་ན་གཟབ་གཟབ་མ་བྱས་ན།
STT_NS_M0184_0012_139607_to_141687,དེ་རིང་རྒན་བཀྲ་བཟང་ཚོགས་ཐེངས་འགྲོ་ཡ་མ་རཱ་བསམ་ཡ་ཅིག་ཡོད་བ།  ,de ring rgan bkra bzang tshogs thengs 'gro ya ma rA bsam ya cig yod ba/__,https://d38pmlk0v88drf.cloudfront.net/wav16k/STT_NS_M0184_0012_139607_to_141687.wav,STT_NS,3,59,2.08,wav16k/STT_NS_M0184_0012_139607_to_141687.wav,དེ་རིང་རྒན་བཀྲབ་བཟང་ཚོགས་ཐེངས་འགྲོ་ཡ་མ་རཱ་བསམ་ཡ་ཅིག་ཡོད་བ།
STT_NS_M0195_0620_4202430_to_4205530,མ་བྱས་ན་དེ་ཚོ་ལ་རོགས་པ་བྱེད་ཡ་འདྲ་བོ་དང་། ཨེ་འདྲའི་བོ་གོ་སྐབས་འདྲ་བོ་རག་ན།  ,ma byas na de tsho la rogs pa byed ya 'dra bo dang /_e 'dra'i bo go skabs 'dra bo rag na/__,https://d38pmlk0v88drf.cloudfront.net/wav16k/STT_NS_M0195_0620_4202430_to_4205530.wav,STT_NS,3,76,3.1,wav16k/STT_NS_M0195_0620_4202430_to_4205530.wav,མ་བྱས་ནས་དེ་ཚོ་ལ་རོགས་པ་བྱེད་ཡ་འདྲ་བོ་དང་། ཨེ་འདྲའི་འདྲ་བོ་གོ་སྐབས་འདྲ་བོ་རག་ན།
STT_NS_M0198_0112_872494_to_874956,ཨ་མ་དེ་ག་དུས་ཡིན་པ་ཡིན་ན་ཡང་ཡོད་བ་སོ་སོ་ཀ་ཅི་ ,a ma de ga dus yin pa yin na yang yod ba so so ka ci _,https://d38pmlk0v88drf.cloudfront.net/wav16k/STT_NS_M0198_0112_872494_to_874956.wav,STT_NS,3,46,2.462,wav16k/STT_NS_M0198_0112_872494_to_874956.wav,ཨ་མ་དེ་ག་དུས་ཡིན་པ་ཡིན་ན་ཡང་ཡོད་བ་སོ་སོ་ཀ་ཅི།
STT_NS_M0194_0058_408932_to_411301,ཇོ་ཇོ་ལ་ཡེ་སྐད་ཆ་འདྲ་བོ་དྲིས་མེད་ཡོད་བ། ཨེ་ནས་ཨོ་དེ་གིས་ ,jo jo la ye skad cha 'dra bo dris med yod ba/_e nas o de gis _,https://d38pmlk0v88drf.cloudfront.net/wav16k/STT_NS_M0194_0058_408932_to_411301.wav,STT_NS,3,57,2.369,wav16k/STT_NS_M0194_0058_408932_to_411301.wav,ཇོ་ཇོ་ལ་ཡང་སྐད་ཆ་འདྲ་བོ་དྲིས་མེད་ཡོད་བ། ཨེ་ནས་ཨོ་དེ་གིས།
STT_TT00443_40.850-42.350,འདི་ཡོང་དགོས་ཡ་གི་གནས་ཚུལ་དེ། ག་ནས་བྱུང་པ་རེད།  ,'di yong dgos ya gi gnas tshul de/_ga nas byung pa red/__,https://d38pmlk0v88drf.cloudfront.net/wav16k/STT_TT00443_40.850-42.350.wav,STT_TT,3,48,1.5,wav16k/STT_TT00443_40.850-42.350.wav,འདི་ཡོང་དགོས་ཡ་གི་གནས་ཚུལ་དེ་ག་འདྲས་བྱུང་པ།
STT_NS_M0198_0194_1503250_to_1508941,ད་གལ་སྲིད་ཡོད་བ་བུ་མོ་དེའི་དགའ་བོ་ད་ཐེངས་མ་ལྔ་བ་འདྲ་བོ་ཡིན་པ་ཡིན་ན། ཨེ་ནས་མི་དེ་ཚོ་གིས་ཡང་ཅིག་ལབ་བསྡད་ཡ་ཅིག་ཡོད་བ། ད་བུ་མོ་ ,da gal srid yod ba bu mo de'i dga' bo da thengs ma lnga ba 'dra bo yin pa yin na/_e nas mi de tsho gis yang cig lab bsdad ya cig yod ba/_da bu mo _,https://d38pmlk0v88drf.cloudfront.net/wav16k/STT_NS_M0198_0194_1503250_to_1508941.wav,STT_NS,3,124,5.691,wav16k/STT_NS_M0198_0194_1503250_to_1508941.wav,ད་གལ་སྲིད་ཡོད་བ་བུ་མོ་དེ་དགའ་བོ་ད་ཐེངས་མ་ལྔ་བ་འདྲ་བོ་ཡིན་པ་ཡིན་ན་ཨེ་ནས་མི་དེ་ཚོ་ཡིས་ཡང་གཅིག་ལབ་བསྡད་ཡ་ཅིག་ཡོད་བ། ད་བུ་མོ།
STT_NS_M0200_0656_4493711_to_4496033,ཨེ་ནས་ཤིང་ཏོག་ཟ་ཡ་དེ་ཚོ་ད་མི་ཀ་ཅི་གཟུགས་ ,e nas shing tog za ya de tsho da mi ka ci gzugs _,https://d38pmlk0v88drf.cloudfront.net/wav16k/STT_NS_M0200_0656_4493711_to_4496033.wav,STT_NS,3,41,2.322,wav16k/STT_NS_M0200_0656_4493711_to_4496033.wav,ཨེ་ནས་ཤིང་ཏོག་ཟ་ཡ་དེ་ཚོ་ད་མི་ཀ་ཅི་གཟུགས།
STT_NS_M0190_0162_1407758_to_1410766,སྐར་མ་གཅིག་རྗེས་ལུས་ཐེབས་རཱ། འོ་དེ་བྱས་ནས་ཨ་ནས་ཉེས་པ་བཏང་རྒྱོ་རེད་འདུག་རཱ།  ,skar ma gcig rjes lus thebs rA/_'o de byas nas a nas nyes pa btang rgyo red 'dug rA/__,https://d38pmlk0v88drf.cloudfront.net/wav16k/STT_NS_M0190_0162_1407758_to_1410766.wav,STT_NS,3,76,3.008,wav16k/STT_NS_M0190_0162_1407758_to_1410766.wav,སྐར་མ་གཅིག་རྗེས་ལུས་ཐེབས་རཱ། ཨོ་དེ་བྱས་ནས་ཨེ་ནས་ཉེས་པ་བཏང་རྒྱོ་རེད་འདུ་རཱ།
STT_NS_M0201_0367_2519189_to_2524616,ཨ་ནས་ད་འཕྲུལ་ཆས་ཀྱིས་ད་དེའི་མི་དེ་ཚོ་ལ་ཡོད་བ་ཡ་ཡུད་དཀའ་ངལ་ཤུགས་ཆེན་པོ་ཞིག་སྤྲད་རེད་ད།  ,a nas da 'phrul chas kyis da de'i mi de tsho la yod ba ya yud dka' ngal shugs chen po zhig sprad red da/__,https://d38pmlk0v88drf.cloudfront.net/wav16k/STT_NS_M0201_0367_2519189_to_2524616.wav,STT_NS,3,87,5.427,wav16k/STT_NS_M0201_0367_2519189_to_2524616.wav,ཨེ་ནས་ད་འཕྲུལ་ཆས་ཀིས་ད་འདི་མི་དེ་ཚོ་ལ་ཡོད་བ་ཡ་ཡུད་དཀའ་ངལ་ཤུགས་ཆེན་པོ་ཞིག་སྤྲད་རེད་ད།
STT_NS_M0196_0322_3562500_to_3569018,མི་ལ་དབྱེ་འབྱེད་བྱེད་སྟངས་ཤེས་པ་ཡིན་ན་ལབ་ཡིན་དཱ་རཱ། ཨ་ནས་ད་དེ་སློབ་སྦྱོང་དེ་ཆོ་ཡོད་མ་རེད་འདྲ་བོ་ཡོད་བ་ང་བསམ་གྱི་འདུག་རཱ།  ,mi la dbye 'byed byed stangs shes pa yin na lab yin dA rA/_a nas da de slob sbyong de cho yod ma red 'dra bo yod ba nga bsam gyi 'dug rA/__,https://d38pmlk0v88drf.cloudfront.net/wav16k/STT_NS_M0196_0322_3562500_to_3569018.wav,STT_NS,3,122,6.518,wav16k/STT_NS_M0196_0322_3562500_to_3569018.wav,མི་ལ་དབྱེ་འབྱེད་བྱེད་སྟངས་ཤེས་པ་ཡིན་ན་ལབ་ཡིན་ད་རཱ། ཨེ་ནས་ད་འདི་སློབ་སྦྱོང་དེ་ཆོ་ཡོད་མ་རེད་འདྲ་བོ་ཡོད་བ་ང་བསམ་གི་འདུག་རཱ། ད།
STT_NS_M0197_0136_1715851_to_1718649,ཁོ་རང་ནི་ལས་ཀ་ལ་སྐྱིད་པོ་མ་བྱུང་། ཨེ་འདྲའི་བྱས་ནས་རླུང་པུ་ར།  ,kho rang ni las ka la skyid po ma byung /_e 'dra'i byas nas rlung pu ra/__,https://d38pmlk0v88drf.cloudfront.net/wav16k/STT_NS_M0197_0136_1715851_to_1718649.wav,STT_NS,3,62,2.798,wav16k/STT_NS_M0197_0136_1715851_to_1718649.wav,ཁོ་རང་ག་ལས་ཀ་ལ་སྐྱིད་པོ་མ་བྱུང་ཨེ་འདྲའི་བྱས་ནས་རླུང་པུ་ར།
STT_NS_M0193_0250_1962906_to_1965274,ཨ་ནས་བྱས་ཙང་ཨ་ནས་ཟ་ཁང་ལ་ཞེ་དྲགས་ཟ་མྱི་ཡོད་མ་རེད་ཡོད་བ།  ,a nas byas tsang a nas za khang la zhe drags za myi yod ma red yod ba/__,https://d38pmlk0v88drf.cloudfront.net/wav16k/STT_NS_M0193_0250_1962906_to_1965274.wav,STT_NS,3,56,2.368,wav16k/STT_NS_M0193_0250_1962906_to_1965274.wav,ཨེ་ནས་བྱས་ཙང་ཨེ་ནས་ཟ་ཁང་ལ་ཞེ་དྲག་ཟ་མྱི་ཡོད་མ་རེད་ཡོད་བ།
STT_NS_M0183_0010_69821_to_72594,ད་དཔེར་ན་ཆ་བཞག་ན་ཁོང་ཚོའི་མོག་མོག་ལ་ཡང་ཡོད་བ་ཨེ་འདྲའི་གོང་དཔེ་ཆེན་པོ་མ་རེད་འདུག་དཱ།  ,da dper na cha bzhag na khong tsho'i mog mog la yang yod ba e 'dra'i gong dpe chen po ma red 'dug dA/__,https://d38pmlk0v88drf.cloudfront.net/wav16k/STT_NS_M0183_0010_69821_to_72594.wav,STT_NS,3,85,2.773,wav16k/STT_NS_M0183_0010_69821_to_72594.wav,ད་དཔེར་ན་ཆ་བཞག་ན་ཁོ་ཚོའི་མོག་མོག་ལ་ཡོད་བ་ ཨེ་འདྲའི་སྒོམ་པེ་ཆེན་པོ་མ་རེད་འདུག་ད།
STT_NS_M0192_0201_1771612_to_1777431,ཡིད་དབང་འཕྲོག་བཅུག་ཡ་ཅིག་འདུག་ད་རེད་བ། ལས་ཀ་འདྲ་བོ་གེ་ཀུ་ཅི་བྱེད་དགོས་མ་རེད། སོ་སོ་ག་རེ་ཡིན་པ་དེར་བསྡད།  ,yid dbang 'phrog bcug ya cig 'dug da red ba/_las ka 'dra bo ge ku ci byed dgos ma red/_so so ga re yin pa der bsdad/__,https://d38pmlk0v88drf.cloudfront.net/wav16k/STT_NS_M0192_0201_1771612_to_1777431.wav,STT_NS,3,105,5.819,wav16k/STT_NS_M0192_0201_1771612_to_1777431.wav,ཡིད་དབང་འཕྲོག་བཆོག་ཡ་ཆེག་དུ་ད་རེད་བ། ལས་ཀ་འདྲ་བོ་གེ་ཀུ་ཅི་བྱེད་དགོས་མ་རེད། སོ་སོ་ག་རེ་ཡིན་པ་དེ་བསྡད།
STT_NS_M0198_0129_996015_to_1001168,བུ་མོ་ལབ་ཡ་དེ་ལ་ཨ་ནས་ད་ག་འདྲའི་འདྲ་བོ་གཅིག་བརྩི་ཡི་ཡོད་མེད་དང་། བུ་ལབ་ཡ་དེ་ལ་ད་ག་འདྲའི་འདྲ་བོ་གཅིག་བརྩི་ཡི་ཡོད་མེད།  ,bu mo lab ya de la a nas da ga 'dra'i 'dra bo gcig brtsi yi yod med dang /_bu lab ya de la da ga 'dra'i 'dra bo gcig brtsi yi yod med/__,https://d38pmlk0v88drf.cloudfront.net/wav16k/STT_NS_M0198_0129_996015_to_1001168.wav,STT_NS,3,117,5.153,wav16k/STT_NS_M0198_0129_996015_to_1001168.wav,བུ་མོ་ལབ་ཡ་དེ་ལ་ཨེ་ནས་ད་ག་འདྲའི་འདྲ་བོ་ཅིག་བརྩི་ཡི་ཡོད་མེད་དང་བུ་ལབ་ཡ་དེ་ལ་ག་འདྲའི་འདྲ་བོ་ཅིག་བརྩི་ཡི་ཡོད་མེད།
STT_NS_M0199_0583_4234735_to_4238046,ཡང་ཨེ་འདྲའི་འདྲ་བོ་ལབ་ཡ་གཅིག་ཡོད་བ་ད་ཁ་པར་དེས་ང་འདོད་པ་ཁེངས་མ་སོང་འདྲ་བོ་ཡོད་བ།  ,yang e 'dra'i 'dra bo lab ya gcig yod ba da kha par des nga 'dod pa khengs ma song 'dra bo yod ba/__,https://d38pmlk0v88drf.cloudfront.net/wav16k/STT_NS_M0199_0583_4234735_to_4238046.wav,STT_NS,3,81,3.311,wav16k/STT_NS_M0199_0583_4234735_to_4238046.wav,ཡང་ཨེ་འདྲའི་འདྲ་བོ་ལབ་ཡ་ཅིག་ཡོད་བ། ད་ཁ་པར་དེ་ང་འདོད་པ་ཁེངས་མ་སོང་འདྲ་བོ་ཡོད་བ།
STT_NS_M0199_0144_1128822_to_1132584,ཨ་ནས་འོ་ཡིན་ཙང་ད་མི་དེ་ཚོ་སྔོན་ནས་ད་གོམ་པ་བརྒྱབ་ནས་ཕར་ཕྱོགས་ཕྱོགས་ལ་རྒྱུགས་ལབ་སོང་།  ,a nas 'o yin tsang da mi de tsho sngon nas da gom pa brgyab nas phar phyogs phyogs la rgyugs lab song /__,https://d38pmlk0v88drf.cloudfront.net/wav16k/STT_NS_M0199_0144_1128822_to_1132584.wav,STT_NS,3,85,3.762,wav16k/STT_NS_M0199_0144_1128822_to_1132584.wav,ཨེ་ནས་ཨོ་ཙང་ད་མི་དེ་ཚོ་སྔོན་ནས་ད་གོམ་པ་བརྒྱབ་ནས་ཕར་ཕྱོགས་ཕྱོགས་ལ་རྒྱུགས་ལབ་སོང་།
STT_NS_M0199_0382_2817334_to_2820085,ཟུར་དེ་བ་ལ་མི་སྐྱོ་བོ་འདྲ་བོ་དང་ཨེ་འདྲའི་བོ།  ,zur de ba la mi skyo bo 'dra bo dang e 'dra'i bo/__,https://d38pmlk0v88drf.cloudfront.net/wav16k/STT_NS_M0199_0382_2817334_to_2820085.wav,STT_NS,3,46,2.751,wav16k/STT_NS_M0199_0382_2817334_to_2820085.wav,ཟུར་དེ་བ་ལ་མི་སྐྱོ་བོ་འདྲ་བོ་དང་ཨེ་འདྲའི་འདྲ་བོ།
STT_NS_M0228_0385_3233114_to_3237039,ད་ཨོ་དེ་ངས་ད་འདི་ངས་ག་བྱས་ནས་ལབ་ཡིན་ལབ་ན་ཡོད་བ་ང་ཚོ།  ,da o de ngas da 'di ngas ga byas nas lab yin lab na yod ba nga tsho/__,https://d38pmlk0v88drf.cloudfront.net/wav16k/STT_NS_M0228_0385_3233114_to_3237039.wav,STT_NS,3,54,3.925,wav16k/STT_NS_M0228_0385_3233114_to_3237039.wav,ད་ཨོ་འདི་ངས་ ད་འདི་ངས་ག་རེ་བྱས་ནས་ལབ་ཡིན་ལབ་ན་ཡོད་བ་ང་ཚོ།
STT_TT00445_438.400-441.250,ད་ང་ཚོའི་ངོས་ནས་ཅིག་དེ་བ། གོས་སློག་སྣེ་མ་རེ་ཙེ་རེ་ཙེ་ཉོས་ནས། འདི་རེད་མ་གཏོགས།  ,da nga tsho'i ngos nas cig de ba/_gos slog sne ma re tse re tse nyos nas/_'di red ma gtogs/__,https://d38pmlk0v88drf.cloudfront.net/wav16k/STT_TT00445_438.400-441.250.wav,STT_TT,3,79,2.8500000000000227,wav16k/STT_TT00445_438.400-441.250.wav,ད་ང་ཚོའི་ངོས་ནས་ཅིག་དེ་བ། གོས་སལོག་རྣལ་མ་རེལ་ཙེ་རུ་ཙེ་རུ་ཉོས། འདི་རེད་མ་གཏོགས།
STT_NS_M0198_0193_1491015_to_1499138,དགའ་བོ་བྱེད་བ་ཡིན་ན་ཡང་ཡོད་བ་ད་མི་དེ་ཚོ་གིས་ད་གང་བྱུང་མང་བྱུང་ལབ་ཀྱི་འདུག་བ། དཔེར་ན་ཆ་བཞག་ན་ད་བུ་མོ་གཅིག་གིས་ད་དགའ་བོ་བྱེད་རེད་དཱ་ཡོད་བ་བུ་གཅིག་མཉམ་དུ།  ,dga' bo byed ba yin na yang yod ba da mi de tsho gis da gang byung mang byung lab kyi 'dug ba/_dper na cha bzhag na da bu mo gcig gis da dga' bo byed red dA yod ba bu gcig mnyam du/__,https://d38pmlk0v88drf.cloudfront.net/wav16k/STT_NS_M0198_0193_1491015_to_1499138.wav,STT_NS,3,153,8.123,wav16k/STT_NS_M0198_0193_1491015_to_1499138.wav,དགའ་བོ་བྱས་བ་ཡིན་ན་ཡང་ཡོད་བ་ད་མི་དེ་ཚོ་གིས་ད་གང་བྱུང་མང་བྱུང་ལབ་ཀི་འདུག་བ། དཔེར་ན་ཆ་བཞག་ན་ད་བུ་མོ་གཅིག་གིས་ད་དགའ་བོ་བྱས་རེད་ད་ཡོད་བ་བུ་གཅིག་མཉམ་དུ།
STT_NS_M0184_0056_502858_to_512158,ད་སོ་སོ་ག་རེ་བྱས་བྱས། སོ་སོ་གི་འདོད་པ་ཚང་མ་བྱེད་ཡ་རག་རག་གི་ཡོད་རཱ་ཡང་། ཨ་ནས་བསྡད་སྡོད་མ་ཤེས་རཱ་ད་ག་རེ་ལབ་དགོས་རེད། གཞུང་གི་ཁ་ལག་ཡོད་ནས་ལས་ད་དུང་གཞུང་གི་ཁ་ལག་དེ་ཞིམ་པོ་མི་འདུག་ལབ་ནས་ང་ཚོ།  ,da so so ga re byas byas/_so so gi 'dod pa tshang ma byed ya rag rag gi yod rA yang /_a nas bsdad sdod ma shes rA da ga re lab dgos red/_gzhung gi kha lag yod nas las da dung gzhung gi kha lag de zhim po mi 'dug lab nas nga tsho/__,https://d38pmlk0v88drf.cloudfront.net/wav16k/STT_NS_M0184_0056_502858_to_512158.wav,STT_NS,3,188,9.3,wav16k/STT_NS_M0184_0056_502858_to_512158.wav,ད་སོ་སོ་ག་རེ་བྱེད་བྱས་སོ་སོ་གི་འདོད་པ་ཚང་མ་བྱེད་ཡ་ག་རག་གི་ཡོད་རཱ་ཡང་། ཨེ་ནས་དེ་དུས་མ་གཞི་ལ་ད་ག་རེ་ལབ་དགོས་རེད། གཞུང་གི་ཁ་ལག་ཡོད་ནས་ལས་ད་དུང་གཞུང་གི་ཁ་ལག་དེ་ཞིམ་པོ་མི་འདུག་ལབ་ནས་ང་ཚོ།
STT_NS_M0190_0041_362181_to_364741,ཧན་ལ་བོད་ཕྲུག་ཁྱིམ་སྡེ་འདྲ་བོ་ཡིན་ན་འཛིན་གྲྭ་ལྔ་བ་བར་དུ་མ་གཏོགས་ཡོད་མ་རེད།  ,han la bod phrug khyim sde 'dra bo yin na 'dzin grwa lnga ba bar du ma gtogs yod ma red/__,https://d38pmlk0v88drf.cloudfront.net/wav16k/STT_NS_M0190_0041_362181_to_364741.wav,STT_NS,3,76,2.56,wav16k/STT_NS_M0190_0041_362181_to_364741.wav,ཧན་ལ་བོད་ཕྲུག་ཁྱིམ་མྡེ་འདྲ་བོ་ཡིན་ན་འཛིན་གྲྭ་ལྔ་བ་བར་དུ་མ་གཏོགས་ཡོད་མ་རེད།
STT_NS_M0199_0180_1403029_to_1408813,འདིའི་མཇུག་ལ་ད་ཏིས་ཙི་ནག་ཁུང་ཆགས་བྲོ་བྱས་རེད་དཱ་རཱ། ད་ཏག་ཏག་ཁོ་རང་ང་ཚོ་ཀ་ཅི་མོ་ཊ་དེ་ཐར་ཤག ,'di'i mjug la da tis tsi nag khung chags bro byas red dA rA/_da tag tag kho rang nga tsho ka ci mo Ta de thar shag_,https://d38pmlk0v88drf.cloudfront.net/wav16k/STT_NS_M0199_0180_1403029_to_1408813.wav,STT_NS,3,90,5.784,wav16k/STT_NS_M0199_0180_1403029_to_1408813.wav,དེའི་མཇུག་ལ་ད་ཏོག་ཙི་ནག་ཁུང་ཆག་འབྲོ་བྱས་རེད་ད་རཱ། ད་ཏག་ཏག་ཁོ་རང་ང་ཚོ་ཀ་ཅི་མོ་ཊ་དེ་ཐར་ཤག
STT_NS_M0207_0148_2120759_to_2125708,རོགས་པ། ཁོ་རང་རོགས་པ་དང་འབྲེལ་བ་ཡོད་ན་ཡོད་བ། འབྲེལ་བ་ཡོད་མ་རེད་ཡོད་བ། ང་ལ་ཡོད་བ་གལ་ཆེ་བ་བརྩི་ཡག་ཅིག་ཡོད་བ།  ,rogs pa/_kho rang rogs pa dang 'brel ba yod na yod ba/_'brel ba yod ma red yod ba/_nga la yod ba gal che ba brtsi yag cig yod ba/__,https://d38pmlk0v88drf.cloudfront.net/wav16k/STT_NS_M0207_0148_2120759_to_2125708.wav,STT_NS,3,108,4.949,wav16k/STT_NS_M0207_0148_2120759_to_2125708.wav,རོགས་པ་ཁོ་རང་རོགས་པ་དང་འབྲེལ་བ་ཡོད་ན་ཡོད་བ་འབྲེལ་བ་ཡོད་མ་རེད་ཡོད་བ། ང་ལ་ཡོད་བ་གལ་ཆེ་བ་བརྩི་ཡ་ཅིག་ཡོད་བ།
