file_name,uni,wylie,url,dept,grade,char_len,audio_len,path,inf
STT_NS_M0193_0493_3596453_to_3605601,སྐད་ཅོར་ཚ་བོ་འདྲ་བོ་ཅིག་ཉི་མ་ཉིན་གང་སྐད་ཅོར་ཡོད་རྒྱོ་གི་ས་ཆ་ཅིག་ལ་བསྡད་བསྡད་ཀི་ཡོད་དུས་ཙམ་པ་ལ། ཨེ་ནས་མི་དེ་གས་དེ་མང་ཆེ་བ་ཅིག་ཅིག་སྤུ་སུད་དོག་པ་འདྲ་བོ་བྱས། ཨེ་ནས་ཅིག་ག་རེ་ལབ་དགོས་རེད།  ,skad cor tsha bo 'dra bo cig nyi ma nyin gang skad cor yod rgyo gi sa cha cig la bsdad bsdad ki yod dus tsam pa la/_e nas mi de gas de mang che ba cig cig spu sud dog pa 'dra bo byas/_e nas cig ga re lab dgos red/__,https://d38pmlk0v88drf.cloudfront.net/wav16k/STT_NS_M0193_0493_3596453_to_3605601.wav,STT_NS,3,184,9.148,wav16k/STT_NS_M0193_0493_3596453_to_3605601.wav,སྐད་ཅོར་ཚ་བོ་འདྲ་བོ་ཅིག་ཉི་མ་ཉིན་གང་སྐད་ཅོར་ཡོད་རྒྱོ་གི་ས་ཆ་གཅིག་ལ་བསྡད་བསྡད་ཡོད་དུས་ཙམ་པ་ལ། ཨེ་ནས་མི་དེ་གས་དེ་མང་ཆེ་བ་ཅིག་གཅིག་བུ་སུབ་དོ་བ་འདྲ་བོ་བྱས། ཨེ་ནས་ཅིག་ག་རེ་ལབ་དགོས་རེད།
STT_NS_M0195_0391_2580900_to_2584337,ཆུ་ཆུ་ཏིས་ཙི་རྫུན་མ་འདྲ་བོ་རྐྱལ་ཨེ་འདྲའི་འདྲ་བོ་ཡ་ཡུད་བྱེད་སྙིང་བྲོ་ཡི་འདུག ,chu chu tis tsi rdzun ma 'dra bo rkyal e 'dra'i 'dra bo ya yud byed snying bro yi 'dug_,https://d38pmlk0v88drf.cloudfront.net/wav16k/STT_NS_M0195_0391_2580900_to_2584337.wav,STT_NS,3,76,3.437,wav16k/STT_NS_M0195_0391_2580900_to_2584337.wav,ཆུ་ཆུ་ཏོག་ཙི་རྫུན་མ་འདྲ་བོ་བརྒལ་ཨེ་འདྲའི་འདྲ་བོ་ཡ་ཡུད་བྱེད་སྙིང་བྲོ་ཡི་འདུག
STT_TT00413_477.600-478.700,སོ་སོ་ཡག་པོ་ཡོང་ཡ་གི།  ,so so yag po yong ya gi/__,https://d38pmlk0v88drf.cloudfront.net/wav16k/STT_TT00413_477.600-478.700.wav,STT_TT,3,23,1.099999999999966,wav16k/STT_TT00413_477.600-478.700.wav,སོ་སོ་ཡག་པོ་ཡོང་ཡ་གི་
STT_NS_M0189_0085_776902_to_786561,ཨེ་ནས་ཚར་གཅིག་ངའི་སྦྱིན་བདག་གཅིག་གིས་ཨེ་འདྲ་བྲིས་ཤག ང་འབྲོག་པ་ཡིན་ལབ་ཤག ང་ལ་ཞི་མི་གཉིས་དང་ཨེ་ནས་བྱ་ཕོ་གསུམ་ཡོད་ལབ་ཤག བྱ་ཕོ་བྱ་མོ་དེ་འདྲ་གསུམ་ཡོད་ལབ་ཤག་ང་འབྲོག་པ་ཡིན་ལབ་ཤག ,e nas tshar gcig nga'i sbyin bdag gcig gis e 'dra bris shag_nga 'brog pa yin lab shag_nga la zhi mi gnyis dang e nas bya pho gsum yod lab shag_bya pho bya mo de 'dra gsum yod lab shag nga 'brog pa yin lab shag_,https://d38pmlk0v88drf.cloudfront.net/wav16k/STT_NS_M0189_0085_776902_to_786561.wav,STT_NS,3,171,9.659,wav16k/STT_NS_M0189_0085_776902_to_786561.wav,ཨེ་ནས་ཚར་གཅིག་ངའི་སྦྱིན་བདག་གཅིག་གིས་ཨེ་འདྲའི་བྲིས་ཤག ང་འབྲོག་པ་ཡིན་ལབ་ཤག ང་ལ་ཞི་མི་གཉིས་དང་ཨེ་ནས་བྱ་ཕོ་གསུམ་ཡོད་ལབ་ཤག བྱ་ཕོ་བྱ་མོ་དེ་འདྲའི་གསུམ་ཡོད་ལབ་ཤག ང་འབྲོག་པ་ཡིན་ལབ་ཤག
STT_NS_M0192_0346_3058489_to_3060964,ང་རང་ད་ལྟ་ང་རང་གི་ག་རེ་ལབ་དགོས་རེད་ད།  ,nga rang da lta nga rang gi ga re lab dgos red da/__,https://d38pmlk0v88drf.cloudfront.net/wav16k/STT_NS_M0192_0346_3058489_to_3060964.wav,STT_NS,3,39,2.475,wav16k/STT_NS_M0192_0346_3058489_to_3060964.wav,ང་རང་ད་ལྟ་ང་རང་གི་ག་རེ་ལབ་དགོས་རེད་ད།
STT_NS_M0200_0776_5297367_to_5299434,འབྲུ་དེ་ཉོས་རཱ་ཨ་ནས་དང་ཤོས་ནས་ཁོ་རང་།  ,'bru de nyos rA a nas dang shos nas kho rang /__,https://d38pmlk0v88drf.cloudfront.net/wav16k/STT_NS_M0200_0776_5297367_to_5299434.wav,STT_NS,3,39,2.067,wav16k/STT_NS_M0200_0776_5297367_to_5299434.wav,འབྲུ་དེ་ཉོས་རཱ། ཨེ་ནས་དང་ཤོས་ནས་ཁོ་རང་།
STT_NS_M0202_0422_3231117_to_3240247,ད་སོ་སོ་གིས་ཕར་ཕྱོགས་ཕྱོགས་དེར་རོགས་པ་དངོས་གནས་དགོས་འདུག་མི་འདུག་རཱ། ཕར་ཕྱོགས་ཕྱོགས་དེ་ལ་ངས་རོགས་པ་བྱས་ན་ཕར་ཕྱོགས་ཕྱོགས་དེ་ལ་ཕན་ས་རེད་མ་རེད་ལྟ་ཡ་རེད་ཡོད་བ།  ,da so so gis phar phyogs phyogs der rogs pa dngos gnas dgos 'dug mi 'dug rA/_phar phyogs phyogs de la ngas rogs pa byas na phar phyogs phyogs de la phan sa red ma red lta ya red yod ba/__,https://d38pmlk0v88drf.cloudfront.net/wav16k/STT_NS_M0202_0422_3231117_to_3240247.wav,STT_NS,3,157,9.13,wav16k/STT_NS_M0202_0422_3231117_to_3240247.wav,ད་སོ་སོ་གི་ཕར་ཕྱོགས་ཕྱོགས་དེ་རོགས་པ་དངོས་གནས་དགོས་འདུག་མི་འདུག་རཱ། ཕར་ཕྱོགས་ཕྱོགས་དེ་ལ་ངས་རོགས་པ་བྱས་ན་ཕར་ཕྱོགས་ཕྱོགས་དེ་ལ་ཕན་སར་རེད་མ་རེད་བལྟ་ཡ་རེད་ཡོད་བ།
STT_NS_M0199_0393_2899963_to_2902483,རྒྱ་གར་ལུང་པ་ནང་ལོགས་ལ་མི་སྐྱོ་བོ་ཨེ་འདྲའི་ཡོད་རེད།  ,rgya gar lung pa nang logs la mi skyo bo e 'dra'i yod red/__,https://d38pmlk0v88drf.cloudfront.net/wav16k/STT_NS_M0199_0393_2899963_to_2902483.wav,STT_NS,3,53,2.52,wav16k/STT_NS_M0199_0393_2899963_to_2902483.wav,རྒྱ་གར་ལུང་པ་ནང་ལོགས་ལ་མི་སྐྱོ་བོ་ཨེ་འདྲའི་ཡོད་རེད།
STT_NS_M0193_0006_71390_to_74837,ཨ་ད་གྲོང་སྡེ་ལབ་དུས་དམིགས་བསལ་ཞེད་སྣང་ཚ་ཉམས་ཁ་བོ་འདྲ་བོ་གཅིག་ཡོད་རེད་རཱ། ཡིན་ན་ཡང་ད།  ,a da grong sde lab dus dmigs bsal zhed snang tsha nyams kha bo 'dra bo gcig yod red rA/_yin na yang da/__,https://d38pmlk0v88drf.cloudfront.net/wav16k/STT_NS_M0193_0006_71390_to_74837.wav,STT_NS,3,86,3.447,wav16k/STT_NS_M0193_0006_71390_to_74837.wav,ཨ་ད་གྲོང་སྡེ་ལབ་དུས་དམིགས་བསལ་ཞེད་སྣང་ཚ་མཉམས་ཁ་བོ་འདྲ་བོ་ཅིག་ཡོད་རེད་རཱ། ཡིན་ན་ཡང་ད།
STT_NS_M0198_0026_182244_to_187226,ནང་མི་དེས་ཡོད་བ་ཨ་མ་དེ་ལ་ཡ་ལ་འཛུགས་ཀྱི་རེད་དང་ཤོས། ཨ་མ་ཁྱོད་རང་དོན་དག་ནས་ཨ་ནས་བུ་མོ་སྐྱེས་རེད།  ,nang mi des yod ba a ma de la ya la 'dzugs kyi red dang shos/_a ma khyod rang don dag nas a nas bu mo skyes red/__,https://d38pmlk0v88drf.cloudfront.net/wav16k/STT_NS_M0198_0026_182244_to_187226.wav,STT_NS,3,96,4.982,wav16k/STT_NS_M0198_0026_182244_to_187226.wav,ནང་མི་དེིས་ཡོད་བ་ཨ་མ་དེ་ལ་ཡ་ལ་བཙུགས་ཀི་རེད་དང་ཤོས། ཨ་མ་ཁྱོད་རང་དོན་དག་ནས་ཨེ་ནས་བུ་མོ་སྐྱེས་རེད་ཟེར།
STT_NS_M0202_0231_1712773_to_1721680,ཨ་ནས་ཡོད་བ་ད་སོ་སོ་གིས་ས་ད་གིན་ཡིན་ལབ་སོང་བ། སོ་སོ་གི་ནང་མི་དང་རོགས་པ་དེ་ཚོར་དཀའ་ངལ་འདྲ་བོ་ཡོད་བ་ཡིན་ན་ཨ་ནས་སོ་སོ་གིས་ཉན་རོགས་བྱེད་ཡ་འདྲ་བོ་དང་ད་ཡོད་བ།  ,a nas yod ba da so so gis sa da gin yin lab song ba/_so so gi nang mi dang rogs pa de tshor dka' ngal 'dra bo yod ba yin na a nas so so gis nyan rogs byed ya 'dra bo dang da yod ba/__,https://d38pmlk0v88drf.cloudfront.net/wav16k/STT_NS_M0202_0231_1712773_to_1721680.wav,STT_NS,3,153,8.907,wav16k/STT_NS_M0202_0231_1712773_to_1721680.wav,ཨེ་ནས་ཡོད་བ་ད་སོ་སོ་གིས་ས་དང་གཅིག་ལབ་སོང་བ། སོ་སོ་གི་ནང་མི་དང་རོགས་པ་དེ་ཚོ་དཀའ་ངལ་འདྲ་བོ་ཡོད་བ་ཡིན་ན་ ཨེ་ནས་སོ་སོ་གིས་ཉན་རོགས་བྱེད་ཡ་འདྲ་བོ་དང་། ད་ཡོད་བ།
STT_NS_M0196_0116_1197791_to_1201077,ཁོང་ཚོ་ཤིང་ལེན་གར་འགྲོ་དུས་ཙམ་པ་ཤིང་ལག་པ་ཡིས་ད་ལེན་ལག་པ་འཆང་ཡ་ཡིན་པ་རཱ་ད།  ,khong tsho shing len gar 'gro dus tsam pa shing lag pa yis da len lag pa 'chang ya yin pa rA da/__,https://d38pmlk0v88drf.cloudfront.net/wav16k/STT_NS_M0196_0116_1197791_to_1201077.wav,STT_NS,3,75,3.286,wav16k/STT_NS_M0196_0116_1197791_to_1201077.wav,ཁོ་ཚོ་ཤིང་ལེན་གར་འགྲོ་དུས་ཙམ་པ་ཤིང་ལག་པ་ཡིས་ད་ལ་ལག་པ་འཆང་ཡ་ཡིན་ཡིན་པ་རཱ་ད།
STT_NS_M0193_0461_3399121_to_3402546,ང་ཚོ་ནོར་བུ་གླིང་ཁ་ནང་ལོགས་ལ་ད་མི་མང་པོ་ཡོད་རེད་ལབ་སོང་བ།  ,nga tsho nor bu gling kha nang logs la da mi mang po yod red lab song ba/__,https://d38pmlk0v88drf.cloudfront.net/wav16k/STT_NS_M0193_0461_3399121_to_3402546.wav,STT_NS,3,59,3.425,wav16k/STT_NS_M0193_0461_3399121_to_3402546.wav,ང་ཚོ་ནོར་བུ་གླིང་ག་ནང་ལོགས་ལ་ད་མི་མང་པོ་ཡོད་རེད་ལབ་སོང་བ།
STT_NS_M0199_0317_2368063_to_2373119,ཨ་ནས་ཡོད་བ་ད་ཡིན་འདྲའི་འདྲ་བོ་བྱེད་དུས་ཡོད་བ། ཕར་མ་ཟད་ད་ཕྱོགས་མི་དེ་ལ་སེམས་ཁྲལ་བསླང་ད་ཨེ་འདྲའི་འདྲ་བ།  ,a nas yod ba da yin 'dra'i 'dra bo byed dus yod ba/_phar ma zad da phyogs mi de la sems khral bslang da e 'dra'i 'dra ba/__,https://d38pmlk0v88drf.cloudfront.net/wav16k/STT_NS_M0199_0317_2368063_to_2373119.wav,STT_NS,3,103,5.056,wav16k/STT_NS_M0199_0317_2368063_to_2373119.wav,ཨེ་ནས་ཡོད་བ་ད་ཨེ་འདྲའི་འདྲ་བོ་བྱེད་དུས་ཡོད་བ་ཕར་ནས་མད་ཕར་ཕྱོགས་མི་དེ་ལ་སེམས་ཁྲལ་ལངས་ད་ཨེ་འདྲའི་འདྲ་བོ།
STT_NS_M0200_0472_3226365_to_3229802,དབྱེ་བ་ཕྱེ་ནས་ཨེ་ནས་ཡང་མགོ་ནས་བེད་སྤྱོད་བཏང་གི་ཡོད་ན་ད་ཡང་སྐད་ཆ་ཡག་ ,dbye ba phye nas e nas yang mgo nas bed spyod btang gi yod na da yang skad cha yag _,https://d38pmlk0v88drf.cloudfront.net/wav16k/STT_NS_M0200_0472_3226365_to_3229802.wav,STT_NS,3,68,3.437,wav16k/STT_NS_M0200_0472_3226365_to_3229802.wav,་དབྱེ་བ་ཕྱེ་ནས་ཨེ་ནས་ཡང་འགོ་ནས་བེད་སྤྱོད་བཏང་གི་ཡོད་ན་ད་ཡང་སྐད་ཆ་ཡག་པོ།
STT_NS_M0200_0697_4809615_to_4811670,དཀའ་ངལ་ག་རེ་མི་དགོས་ག་རེ་བཟོས་བ་ཡིན་ན་ཡང་ཡོད་བ།  ,dka' ngal ga re mi dgos ga re bzos ba yin na yang yod ba/__,https://d38pmlk0v88drf.cloudfront.net/wav16k/STT_NS_M0200_0697_4809615_to_4811670.wav,STT_NS,3,49,2.055,wav16k/STT_NS_M0200_0697_4809615_to_4811670.wav,དཀའ་ངལ་ག་རེ་མི་དགོས་ག་རེ་བཟོས་བ་ཡིན་ན་ཡང་ཡོད་བ།
STT_NS_M0194_0367_2608609_to_2616254,ང་རང་ད་ག་རེ་ལབ་དགོས་རེད་བྷེལ་ཀོབ་ལ་སྤུན་རྒྱ་ཁོ་རང་ཚོ་མ་ཤས་མེད་དུས་ཙམ་པ་ལ། ཨ་ནས་ཁོ་རང་ཚོས་དཔེ་ཡག་པོ་བྱས་སོང་རཱ་ང་ལ་ཁ་ལག་སྤྲད་ཡ་ཞོགས་ཀ་ཁ་ལག་སྤྲད་ཡ་འདྲ་བོ་དང་།  ,nga rang da ga re lab dgos red b+hel kob la spun rgya kho rang tsho ma shas med dus tsam pa la/_a nas kho rang tshos dpe yag po byas song rA nga la kha lag sprad ya zhogs ka kha lag sprad ya 'dra bo dang /__,https://d38pmlk0v88drf.cloudfront.net/wav16k/STT_NS_M0194_0367_2608609_to_2616254.wav,STT_NS,3,158,7.645,wav16k/STT_NS_M0194_0367_2608609_to_2616254.wav,ང་རང་ད་ག་རེ་ལབ་དགོས་རེད། བྷེལ་ཀོབ་ལ་སྤུན་རྒྱ་ཁོ་རང་ཚོ་མ་ཤས་མེད་དུས་ཙམ་པ་ལ་ཨེ་ནས་ཁོ་རང་ཚོ་དཔེ་ཡག་པོ་བྱས་སོང་རཱ། ང་རང་ཁ་ལག་སྤྲད་ཡ། ཞོགས་ཀས་ཁ་ལག་སྤྲད་ཡ་འདྲ་བོ་དང་།
STT_NS_M0195_0056_408085_to_412996,ད་ང་ཚོ་ད་ལྟ་འདི་ལ་ད་གུང་སེང་འདྲ་བོ་དམིགས་བསལ་རག་མ་སོང་རཱ། ཨེ་ནས་བཤད་ན་ཡེ་བཤད་ཡ་མེད་རྒྱོ་འདྲ་བོ་ཅིག་ ,da nga tsho da lta 'di la da gung seng 'dra bo dmigs bsal rag ma song rA/_e nas bshad na ye bshad ya med rgyo 'dra bo cig _,https://d38pmlk0v88drf.cloudfront.net/wav16k/STT_NS_M0195_0056_408085_to_412996.wav,STT_NS,3,100,4.911,wav16k/STT_NS_M0195_0056_408085_to_412996.wav,ད་ང་ཚོ་ད་ལྟ་འདི་ལ་ད་གུང་སེང་འདྲ་བོ་དམིགས་བསལ་རག་མ་སོང་རཱ། ཨེ་ནས་བཤད་ན་བཤད་ཡ་མེད་རྒྱོ་འདྲ་བོ་ཅིག
STT_NS_M0202_0121_925025_to_927185,གཞན་པ་བཟང་སྤྱོད་ཀི་ལས་ཀ་ག་རེ་འདྲ་བོ་ཡོད་རེད་ལབ་ན་སོ་སོ་ ,gzhan pa bzang spyod ki las ka ga re 'dra bo yod red lab na so so _,https://d38pmlk0v88drf.cloudfront.net/wav16k/STT_NS_M0202_0121_925025_to_927185.wav,STT_NS,3,56,2.16,wav16k/STT_NS_M0202_0121_925025_to_927185.wav,གཞན་པ་བཟང་སྤྱོད་ཀི་ལས་ཀ་ག་རེ་འདྲ་བོ་ཡོད་རེད་ལབ་ན་སོ་སོ།
STT_NS_M0199_0590_4279462_to_4285998,ད་མི་ཚེའི་ནང་ལོགས་ལ་དངོས་གནས་ཁོ་རང་མི་དེ་ཚོ་འདོད་པ་ཁེངས་མཁན་མེད་པ་དེ་དངོས་གནས་རེད་ཤག་ཡོད་བ་སོ་སོ་ལ་ག་ཚོད་མི་དགོས་ག་ཚོད་ཡོད་པ་ཡིན་ན་ཡང་ཡོད་བ།  ,da mi tshe'i nang logs la dngos gnas kho rang mi de tsho 'dod pa khengs mkhan med pa de dngos gnas red shag yod ba so so la ga tshod mi dgos ga tshod yod pa yin na yang yod ba/__,https://d38pmlk0v88drf.cloudfront.net/wav16k/STT_NS_M0199_0590_4279462_to_4285998.wav,STT_NS,3,142,6.536,wav16k/STT_NS_M0199_0590_4279462_to_4285998.wav,ད་མི་ཚེའི་ནང་ལོགས་ལ་དངོས་གནས་ཁོ་རང་མི་དེ་ཚོ་འདོད་པ་ཁེངས་མྱི་མེད་བ་དེ་དངོས་གནས་རེད་ཤག་ཡོད་བ། སོ་སོ་ལ་ག་ཚོད་མི་དགོས་ག་ཚོད་ཡོད་བ་ཡིན་ན་ཡང་ཡོད་བ།
STT_NS_M0192_0091_806356_to_809138,ཁོ་འདི་ཁོ་འདི་གོན་ཤག ཁོ་གཉིས་གོན་ཤག་ཁོ་གསུམ་གོན་ཤག ,kho 'di kho 'di gon shag_kho gnyis gon shag kho gsum gon shag_,https://d38pmlk0v88drf.cloudfront.net/wav16k/STT_NS_M0192_0091_806356_to_809138.wav,STT_NS,3,51,2.782,wav16k/STT_NS_M0192_0091_806356_to_809138.wav,ཁོ་འདི་ཁོ་འདི་གོན་ཤག ཁོ་གཉིད་གོན་ཤག ཁོ་གསུམ་གོན་ཤག
STT_NS_M0200_0312_2104829_to_2107975,ཨེ་ནས་ཨོ་དེའི་སྐབས་སུ་སོ་སོ་གི་རང་བྱུང་གི་ཁོར་ཡུག ,e nas o de'i skabs su so so gi rang byung gi khor yug_,https://d38pmlk0v88drf.cloudfront.net/wav16k/STT_NS_M0200_0312_2104829_to_2107975.wav,STT_NS,3,50,3.146,wav16k/STT_NS_M0200_0312_2104829_to_2107975.wav,ཨེ་ནས་ཨོ་དེའི་སྐབས་སུ་སོ་སོ་གི་རང་བྱུང་གི་ཁོར་ཡུག
STT_NS_M0191_0105_1321203_to_1326237,ཅ་ལག་བསྡུ་གསོག་བརྒྱབ་ཚང་མ་བྱེད་དགོས་རཱ། ཨེ་ནས་སང་ཉིན་འགྲོ་དགོས་མེད་ན་ཡང་ལྷོད་ལྷོད་བྱས་ནས་བསྡད་ནས་ཡང་སང་ཉིན་བྱེད་ཡ་ཡོད་རཱ་ཡང་།  ,ca lag bsdu gsog brgyab tshang ma byed dgos rA/_e nas sang nyin 'gro dgos med na yang lhod lhod byas nas bsdad nas yang sang nyin byed ya yod rA yang /__,https://d38pmlk0v88drf.cloudfront.net/wav16k/STT_NS_M0191_0105_1321203_to_1326237.wav,STT_NS,3,127,5.034,wav16k/STT_NS_M0191_0105_1321203_to_1326237.wav,ཅ་ལག་བསྡུ་གསོ་བརྒྱབ་ཚང་མ་བྱེད་དགོས་རཱ། ཨེ་ནས་སང་ཉིན་འགྲོ་དགོས་མེད་ན་ཡང་ལྷོད་ལྷོད་བྱས་ནས་བསྡད་རེད། ཡང་སང་ཉིན་བྱེད་ཡ་ཡོད་རཱ་ཡང་།
STT_NS_M0186_0039_319070_to_321278,མཐོང་རཱ་ང་ཡང་ཇོཀཱ་ཚ་བོ་མཐོང་ཡ་ཅིག་ཡོད་བ། དང་པོའི་སྐབས་སུ་ད་ཡོད་བ།  ,mthong rA nga yang jokA tsha bo mthong ya cig yod ba/_dang po'i skabs su da yod ba/__,https://d38pmlk0v88drf.cloudfront.net/wav16k/STT_NS_M0186_0039_319070_to_321278.wav,STT_NS,3,67,2.208,wav16k/STT_NS_M0186_0039_319070_to_321278.wav,མཐོང་རཱ། ང་ཡང་ཇོཀཱ་ཚ་བོ་མཐོང་ཡ་ཅིག་ཡོད་བ། དང་པོི་སྐབས་སུ་ད་ཡོད་བ།
STT_NS_M0194_0273_1908506_to_1911749,སྐད་ཁོ་རང་བརྒྱབ་ནས་ཨ་མ་བཞག་རོགས་བྱེད་ཀི་མི་འདུག་རཱ། ཨེ་ནས།  ,skad kho rang brgyab nas a ma bzhag rogs byed ki mi 'dug rA/_e nas/__,https://d38pmlk0v88drf.cloudfront.net/wav16k/STT_NS_M0194_0273_1908506_to_1911749.wav,STT_NS,3,60,3.243,wav16k/STT_NS_M0194_0273_1908506_to_1911749.wav,སྐད་ཁོ་རང་བརྒྱབ་ནས་ཨ་མ་བཞག་རོགས་བྱེད་ཀི་མི་འདུག་རཱ། ཨེ་ནས།
STT_NS_M0199_0098_776443_to_783304,ཏིས་ཙི་ཅིག་ལུག་རྒྱོ་འདྲ་བོ་དང་། ཤིང་སྡོང་ལུག་རྒྱོ་འདྲ་བོ་དང་རྡོག་འཛག་རྒྱོ་འདྲ་བོ་དང་ཨེ་འདྲའི་འདྲ་བོ་མང་དྲགས་ཡ་འདུག་ཡོད་བ། ཨོ་དེ་ཚོ་ད་ད་ཆུང་ཆུང་ཆུང་ཆུང་རེད་ཤག་ཡོད་བ།  ,tis tsi cig lug rgyo 'dra bo dang /_shing sdong lug rgyo 'dra bo dang rdog 'dzag rgyo 'dra bo dang e 'dra'i 'dra bo mang drags ya 'dug yod ba/_o de tsho da da chung chung chung chung red shag yod ba/__,https://d38pmlk0v88drf.cloudfront.net/wav16k/STT_NS_M0199_0098_776443_to_783304.wav,STT_NS,3,166,6.861,wav16k/STT_NS_M0199_0098_776443_to_783304.wav,ཏོག་ཙི་ཅིག་ལུག་རྒྱོ་འདྲ་བོ་དང་། ཤིང་སྡོང་ལུག་རྒྱོ་འདྲ་བོ་དང་རྡོ་འཛགས་རྒྱོ་འདྲ་བོ་དང་ཨེ་འདྲའི་འདྲ་བོ་མང་དྲགས་ཡ་འདུག་ཡོད་བ། ཨོ་དེ་ཚོ་ད་ད་ཆུང་ཆུང་ཆུང་ཆུང་རེད་ཤག་ཡོད་བ།
STT_NS_M0200_0684_4699155_to_4702363,ཚལ་དེ་ཚོ་མགྱོགས་པོ་སྐྱེས་ཡ་ཆེད་དུ་ཡང་མིན་ན་སོ་སོ།  ,tshal de tsho mgyogs po skyes ya ched du yang min na so so/__,https://d38pmlk0v88drf.cloudfront.net/wav16k/STT_NS_M0200_0684_4699155_to_4702363.wav,STT_NS,3,51,3.208,wav16k/STT_NS_M0200_0684_4699155_to_4702363.wav,ཚལ་དེ་ཚོ་མགྱོགས་པོ་སྐྱེས་ཡ་ཆེད་དུ་ཡང་མིན་ན་སོ་སོ།
STT_NS_M0193_0177_1558599_to_1562198,ནོར་བུ་གླིང་ཀ་ལ་ངེད་ཀིས་སྔོན་ལ་དང་འགྲེལ་བཤད་རྒྱག་དུས་ཙམ་པ་ལ་ཨེ་ན་བོད་པ་ཡོད་རྒྱོ་གཅིག་ ,nor bu gling ka la nged kis sngon la dang 'grel bshad rgyag dus tsam pa la e na bod pa yod rgyo gcig _,https://d38pmlk0v88drf.cloudfront.net/wav16k/STT_NS_M0193_0177_1558599_to_1562198.wav,STT_NS,3,86,3.599,wav16k/STT_NS_M0193_0177_1558599_to_1562198.wav,ནོར་བུ་གླིང་ག་ལ་ངེས་ཀིས་སྔོན་ལ་དང་འགྲེལ་བཤད་རྒྱག་དུས་ཙམ་པ་ལ་ཨེ་ནས་བོད་པ་ཡོད་རྒྱོ་གཅིག
STT_NS_M0199_0539_3930924_to_3935324,དམིགས་བསལ་དེ་རིང་སང་སྤྱི་ཚོགས་དྲྭ་རྒྱ་ནང་ལོགས་ལ་མི་དེ་ཚོ་ཡིས་སོ་སོ་ད་གང་བྱུང་མང་བྱུང་བླུགས་དུས་ཡོད་བ།  ,dmigs bsal de ring sang spyi tshogs drwa rgya nang logs la mi de tsho yis so so da gang byung mang byung blugs dus yod ba/__,https://d38pmlk0v88drf.cloudfront.net/wav16k/STT_NS_M0199_0539_3930924_to_3935324.wav,STT_NS,3,103,4.4,wav16k/STT_NS_M0199_0539_3930924_to_3935324.wav,དམིགས་བསལ་དེ་རིང་ཁ་སང་སྤྱི་ཚོགས་དྲྭ་རྒྱ་ནང་ལོགས་ལ་མི་དེ་ཚོ་ཡིས་སོ་སོ་ད་གང་བྱུང་མང་མང་བྱུང་བླུག་དུས་ཡོད་བ།
STT_NS_M0205_0322_2793098_to_2795896,འདི་འདྲ་གཅིག་པུ་མ་རེད་ད། ཕ་མ་གིས་ག་རེ་བྱེད་རྒྱོ་ཡིན་ན་ད་ ,'di 'dra gcig pu ma red da/_pha ma gis ga re byed rgyo yin na da _,https://d38pmlk0v88drf.cloudfront.net/wav16k/STT_NS_M0205_0322_2793098_to_2795896.wav,STT_NS,3,57,2.798,wav16k/STT_NS_M0205_0322_2793098_to_2795896.wav,དེ་འདྲའི་གཅིག་པོ་མ་རེད་ད་ ཕ་མ་གིས་ག་རེ་བྱས་རྒྱོ་ཡོད་ན་རེ།
